NIST IR 8477-Based Set Theory Relationship Mapping (STRM),,,,,,Focal Document:,HIPAA,,,,
Target Document:,CJIS Security Policy,,,,,Focal Document URL:,https://www.hhs.gov/hipaa/for-professionals/security/guidance/cybersecurity/index.html,,,,
,,,,,,,,,,,,
FDE#,FDE Name,Focal Document Element (FDE),Confidence Levels,NIST IR-8477 Rational,STRM Rationale,STRM Relationship,Strength of Relationship,CJIS Control Title,Target ID #,CJIS Control Description,Notes
164.306(a),Ensure Confidentiality Integrity and Availability,Covered entities must ensure the CIA of all electronic protected health information and protect against reasonably anticipated threats.,high,semantic,"HIPAA 164.306(a) requires covered entities to ensure confidentiality, integrity, and availability of all ePHI and protect against anticipated threats. CJIS 5.17.PL-8 requires development of security and privacy architectures that describe requirements and approaches for protecting CIA of organizational information. Both mandate a foundational organizational commitment to CIA principles for sensitive information.",intersects_with,4,5.17.PL-8 Security And Privacy Architectures,5.17.PL-8,Develop security and privacy architectures for the system that describe the requirements and approach to be taken for protecting the confidentiality integrity and availability of organizational information.,"HIPAA covers ePHI broadly; CJIS covers CJI. Both establish CIA as the foundational security objective. HIPAA additionally covers patient health information in all forms; CJIS additionally covers criminal justice information in law enforcement contexts."
164.306(a),Ensure Confidentiality Integrity and Availability,Covered entities must ensure the CIA of all electronic protected health information and protect against reasonably anticipated threats.,high,semantic,"HIPAA 164.306(a) requires protection against reasonably anticipated threats to ePHI security. CJIS 5.19.RA-3 requires conducting a risk assessment identifying threats and vulnerabilities and determining likelihood and magnitude of harm. Both require proactive identification and mitigation of threats to sensitive information.",intersects_with,4,5.19.RA-3 Risk Assessment,5.19.RA-3,Conduct a risk assessment including identifying threats to and vulnerabilities in the system; determining the likelihood and magnitude of harm from unauthorized access.,"HIPAA additionally covers operational and administrative threats to ePHI; CJIS additionally covers threats specific to criminal justice information systems."
164.306(b),Flexibility of Approach,Covered entities may use any security measures that allow reasonable and appropriate implementation taking into account size complexity capabilities costs and probability of risks.,high,semantic,"HIPAA 164.306(b) requires covered entities to consider size, complexity, capabilities, costs, and risk probability when selecting security measures. CJIS 5.19.RA-3 requires risk assessments that determine the likelihood and magnitude of harm to guide security decisions. Both require risk-informed and context-sensitive security decision making.",intersects_with,4,5.19.RA-3 Risk Assessment,5.19.RA-3,Conduct a risk assessment including identifying threats to and vulnerabilities in the system; determining the likelihood and magnitude of harm from unauthorized access.,"HIPAA additionally provides a flexibility framework for covered entities to select measures based on organizational factors; CJIS additionally mandates specific assessment frequencies and remediation timeframes."
164.306(c),Standards,A covered entity must comply with all standards in §164.308 §164.310 §164.312 §164.314 and §164.316.,high,semantic,"HIPAA 164.306(c) requires covered entities to comply with all enumerated security standards. CJIS 5.17.PL-2 requires development of security and privacy plans consistent with the enterprise architecture that describe controls planned for meeting security requirements. Both establish mandatory compliance frameworks for protecting sensitive information.",equal,10,5.17.PL-2 System Security And Privacy Plans,5.17.PL-2,Develop security and privacy plans for the system that are consistent with the organization's enterprise architecture and describe the controls in place or planned for meeting the security and privacy requirements.,HIPAA standards apply to ePHI; CJIS standards apply to CJI. Both represent comprehensive compliance frameworks requiring documented adherence to enumerated security controls.
164.306(d),Implementation Specifications,Implementation specifications are required or addressable; covered entities must implement required specifications and assess addressable ones.,high,semantic,"HIPAA 164.306(d) establishes a tiered system of required and addressable implementation specifications requiring documentation when an addressable specification is not implemented. CJIS 5.17.PL-11 requires tailoring the selected control baseline by applying specified tailoring actions. Both allow risk-based tailoring of security controls with documentation requirements.",intersects_with,4,5.17.PL-11 Baseline Tailoring,5.17.PL-11,Tailor the selected control baseline by applying specified tailoring actions.,"HIPAA distinguishes between required and addressable specifications; CJIS uses a formal tailoring process. HIPAA additionally requires documentation of why addressable specifications are not implemented; CJIS additionally defines a structured baseline selection process."
164.306(e),Maintenance,Security measures must be reviewed and modified as needed to continue providing reasonable and appropriate protection of ePHI.,high,semantic,"HIPAA 164.306(e) requires ongoing review and modification of security measures to maintain appropriate protection of ePHI. CJIS 5.17.PL-2 requires reviewing system security and privacy plans at least annually and updating them to address changes. Both mandate continuous maintenance and updating of security controls to respond to changing conditions.",equal,10,5.17.PL-2 System Security And Privacy Plans,5.17.PL-2,Develop security and privacy plans for the system that are consistent with the organization's enterprise architecture; review the system security and privacy plans at least annually.,"Both require periodic review and update of security measures/plans in response to environmental or operational changes. HIPAA frames this as ongoing maintenance of safeguards; CJIS frames it as annual plan review and update."
164.308(a)(1)(i),Security Management Process,Implement policies and procedures to prevent detect contain and correct security violations.,high,semantic,"HIPAA 164.308(a)(1)(i) requires policies and procedures to prevent, detect, contain, and correct security violations. CJIS 5.3.IR-1 requires development of agency-level incident response policy and procedures addressing preparation, detection, containment, and recovery. Both require comprehensive security management frameworks addressing the full lifecycle of security events.",equal,10,5.3.IR-1 Policy and Procedures,5.3.IR-1,Develop document and disseminate agency-level incident response policy and procedures addressing purpose scope roles responsibilities and compliance.,Both require formal policies and procedures for managing the full lifecycle of security events including prevention detection containment and correction/recovery.
164.308(a)(1)(i),Security Management Process,Implement policies and procedures to prevent detect contain and correct security violations.,high,semantic,"HIPAA 164.308(a)(1)(i) requires security management policies and procedures. CJIS 5.5.AC-1 requires development of agency-level access control policy and procedures. Both mandate formal documented policy frameworks as the foundation of security management.",intersects_with,4,5.5.AC-1 Policy and Procedures,5.5.AC-1,Develop document and disseminate to organizational personnel with access control responsibilities: agency-level access control policy and procedures to facilitate the implementation of the access control policy.,"HIPAA covers broad security management; CJIS AC-1 covers access control specifically. HIPAA additionally addresses incident containment and correction; CJIS additionally provides specific access control implementation guidance."
164.308(a)(1)(ii)(A),Risk Analysis,Conduct an accurate and thorough assessment of potential risks and vulnerabilities to the CIA of ePHI.,high,semantic,"HIPAA 164.308(a)(1)(ii)(A) requires accurate and thorough assessment of potential risks and vulnerabilities to ePHI CIA. CJIS 5.19.RA-3 requires conducting a risk assessment identifying threats and vulnerabilities and determining likelihood and magnitude of harm. Both require systematic analysis of risks to sensitive information systems.",equal,10,5.19.RA-3 Risk Assessment,5.19.RA-3,Conduct a risk assessment including identifying threats to and vulnerabilities in the system; determining the likelihood and magnitude of harm from unauthorized access use disclosure disruption modification or destruction.,"Both require comprehensive risk and vulnerability assessments covering CIA impacts. HIPAA specifies assessment of ePHI; CJIS specifies assessment of CJI systems."
164.308(a)(1)(ii)(A),Risk Analysis,Conduct an accurate and thorough assessment of potential risks and vulnerabilities to the CIA of ePHI.,high,semantic,"HIPAA 164.308(a)(1)(ii)(A) requires vulnerability assessment. CJIS 5.19.RA-5 requires monitoring and scanning for vulnerabilities at least monthly. Both address identification of vulnerabilities in information systems holding sensitive data.",intersects_with,4,5.19.RA-5 Vulnerability Monitoring and Scanning,5.19.RA-5,Monitor and scan for vulnerabilities in the system and hosted applications at least monthly and when new vulnerabilities potentially affecting the system are identified and reported.,"HIPAA requires a comprehensive risk analysis as a periodic assessment; CJIS requires continuous vulnerability scanning. HIPAA additionally addresses broader risk probability and criticality; CJIS additionally specifies remediation timeframes by severity."
164.308(a)(1)(ii)(B),Risk Management,Implement security measures sufficient to reduce risks and vulnerabilities to a reasonable and appropriate level.,high,semantic,"HIPAA 164.308(a)(1)(ii)(B) requires implementing security measures sufficient to reduce risks to a reasonable and appropriate level. CJIS 5.19.RA-7 requires responding to findings from security assessments in accordance with organizational risk tolerance. Both require risk-based implementation of security measures to reduce identified risks.",equal,10,5.19.RA-7 Risk Response,5.19.RA-7,Respond to findings from security and privacy assessments monitoring and audits in accordance with organizational risk tolerance.,Both require taking risk-informed action to reduce identified vulnerabilities and risks to an acceptable level. HIPAA applies to ePHI; CJIS applies to CJI.
164.308(a)(1)(ii)(B),Risk Management,Implement security measures sufficient to reduce risks and vulnerabilities to a reasonable and appropriate level.,high,semantic,"HIPAA 164.308(a)(1)(ii)(B) requires risk reduction measures. CJIS 5.19.RA-5 requires vulnerability remediation within defined timeframes. Both require action to mitigate identified security vulnerabilities.",intersects_with,4,5.19.RA-5 Vulnerability Monitoring and Scanning,5.19.RA-5,Monitor and scan for vulnerabilities in the system and hosted applications at least monthly; remediate legitimate vulnerabilities within defined timeframes.,"HIPAA requires general risk reduction measures; CJIS specifies quantitative remediation timeframes by severity. HIPAA additionally addresses broader risk management strategies; CJIS additionally requires automated scanning tools."
164.308(a)(1)(ii)(C),Sanction Policy,Apply appropriate sanctions against workforce members who fail to comply with security policies and procedures.,high,semantic,"HIPAA 164.308(a)(1)(ii)(C) requires appropriate sanctions against workforce members who fail to comply with security policies and procedures. CJIS 5.12.4 requires a formal sanctions process for personnel failing to comply with established information security policies and procedures. Both require formal enforcement mechanisms for security policy compliance.",equal,10,5.12.4 Personnel Sanctions,5.12.4,The agency shall employ a formal sanctions process for personnel failing to comply with established information security policies and procedures.,Both require formal documented sanctions processes for workforce members who fail to comply with security policies. Direct semantic equivalence.
164.308(a)(1)(ii)(D),Information System Activity Review,Implement procedures to regularly review records of information system activity such as audit logs access reports and security incident tracking reports.,high,semantic,"HIPAA 164.308(a)(1)(ii)(D) requires regular review of information system activity including audit logs and access reports. CJIS 5.4.AU-6 requires weekly review and analysis of system audit records for indications of inappropriate or unusual activity. Both require regular review and analysis of audit records to detect security anomalies.",equal,10,5.4.AU-6 Audit Record Review Analysis and Reporting,5.4.AU-6,Review and analyze system audit records weekly for indications of inappropriate or unusual activity and the potential impact; report findings to organizational personnel with audit review and information security responsibilities.,"Both require regular review of audit records and reports for security monitoring. HIPAA specifies review of audit logs, access reports, and incident tracking; CJIS specifies weekly review frequency and reporting requirements."
164.308(a)(1)(ii)(D),Information System Activity Review,Implement procedures to regularly review records of information system activity such as audit logs access reports and security incident tracking reports.,high,semantic,"HIPAA 164.308(a)(1)(ii)(D) requires review of system activity records. CJIS 5.4.AU-2 requires identifying types of events for logging including authentication, file use, and user management events. Both require systematic logging and review of system activity.",intersects_with,4,5.4.AU-2 Event Logging,5.4.AU-2,Identify the types of events that the system is capable of logging in support of the audit function including authentication file use user/group management and operational transactions.,"HIPAA focuses on review of existing records; CJIS AU-2 focuses on defining what to log. HIPAA additionally covers access reports and incident tracking; CJIS additionally specifies event types and annual update requirements."
164.308(a)(2),Assigned Security Responsibility,Identify the security official responsible for development and implementation of security policies and procedures.,high,semantic,"HIPAA 164.308(a)(2) requires identification of a security official responsible for security policies and procedures. CJIS 5.6.IA-1 requires designating an individual with security responsibilities to manage identification and authentication policy and procedures. Both require designation of responsible individuals for security program management.",intersects_with,4,5.6.IA-1 Policy and Procedures,5.6.IA-1,Designate an individual with security responsibilities to manage the development documentation and dissemination of the identification and authentication policy and procedures.,"HIPAA requires a single designated security official for the entire security program; CJIS IA-1 designates responsibility for a specific control family. HIPAA is broader in scope; CJIS additionally covers specific IA policy domains."
164.308(a)(2),Assigned Security Responsibility,Identify the security official responsible for development and implementation of security policies and procedures.,high,semantic,"HIPAA 164.308(a)(2) requires identification of a security official. CJIS 5.3.IR-1 requires designating an individual with security responsibilities to manage incident response policy. Both require formal assignment of security management responsibility.",intersects_with,4,5.3.IR-1 Policy and Procedures,5.3.IR-1,Designate an individual with security responsibilities to manage the development documentation and dissemination of the incident response policy and procedures.,HIPAA establishes a single security official; CJIS establishes designated responsibility across multiple control families. Both require formal assignment of security accountability.
164.308(a)(3)(i),Workforce Security,Implement policies and procedures to ensure appropriate ePHI access and prevent unauthorized access.,high,semantic,"HIPAA 164.308(a)(3)(i) requires policies and procedures to ensure appropriate ePHI access and prevent unauthorized access by workforce members. CJIS 5.5.AC-1 requires agency-level access control policy addressing roles, responsibilities, and compliance. Both require formal access control policies governing workforce access to sensitive information.",equal,10,5.5.AC-1 Policy and Procedures,5.5.AC-1,Develop document and disseminate agency-level access control policy that addresses purpose scope roles responsibilities management commitment coordination among organizational entities and compliance.,Both require formal access control policies ensuring appropriate access by authorized personnel and preventing unauthorized access to sensitive information.
164.308(a)(3)(i),Workforce Security,Implement policies and procedures to ensure appropriate ePHI access and prevent unauthorized access.,high,semantic,"HIPAA 164.308(a)(3)(i) requires workforce access policies. CJIS 5.5.AC-2 requires defining and documenting types of accounts allowed and assigning account managers to control system access. Both require systematic management of workforce access authorizations.",intersects_with,4,5.5.AC-2 Account Management,5.5.AC-2,Define and document the types of accounts allowed and specifically prohibited for use within the system; assign account managers; specify authorized users and access authorizations for each account.,"HIPAA focuses on policy-level workforce access controls; CJIS AC-2 provides detailed technical account management requirements. HIPAA additionally addresses workforce clearance procedures; CJIS additionally specifies account lifecycle management procedures."
164.308(a)(3)(ii)(A),Authorization and/or Supervision,Implement procedures for authorization and/or supervision of workforce members who work with ePHI.,high,semantic,"HIPAA 164.308(a)(3)(ii)(A) requires procedures for authorization and supervision of workforce members accessing ePHI. CJIS 5.5.AC-2 requires approval processes for account creation and management based on valid access authorization. Both require formal authorization processes before granting access to sensitive information.",equal,10,5.5.AC-2 Account Management,5.5.AC-2,Define and document the types of accounts allowed; require approvals by organizational personnel with account management responsibilities for requests to create accounts; authorize access to the system based on a valid access authorization.,"Both require formal authorization and approval processes before workforce members receive access to sensitive information. HIPAA covers ePHI access authorization and supervision; CJIS covers account management authorization."
164.308(a)(3)(ii)(B),Workforce Clearance Procedure,Implement procedures to determine that access of a workforce member to ePHI is appropriate.,high,semantic,"HIPAA 164.308(a)(3)(ii)(B) requires procedures to determine whether workforce access to ePHI is appropriate. CJIS 5.12.1 requires state and national fingerprint-based record checks prior to granting access to CJI for all personnel with unescorted access. Both require pre-access screening to ensure appropriateness of access.",intersects_with,4,5.12.1 Personnel Screening Requirements,5.12.1,State of residency and national fingerprint-based record checks shall be conducted prior to granting access to CJI for all personnel who have unescorted access to unencrypted CJI.,"HIPAA requires determination of access appropriateness without specifying methods; CJIS requires specific fingerprint-based record checks. HIPAA additionally covers ongoing appropriateness assessment; CJIS additionally defines specific disqualifying criteria."
164.308(a)(3)(ii)(B),Workforce Clearance Procedure,Implement procedures to determine that access of a workforce member to ePHI is appropriate.,high,semantic,"HIPAA 164.308(a)(3)(ii)(B) requires determining appropriate access. CJIS 5.5.AC-6 requires employing least privilege principles. Both address ensuring only appropriate access is granted to sensitive information systems.",intersects_with,4,5.5.AC-6 Least Privilege,5.5.AC-6,Employ the principle of least privilege allowing only authorized accesses for users that are necessary to accomplish assigned organizational tasks.,"HIPAA focuses on procedures to verify access appropriateness; CJIS focuses on technical implementation of least privilege. Both ensure workforce access is limited to what is appropriate and necessary."
164.308(a)(3)(ii)(C),Termination Procedures,Implement procedures for terminating access to ePHI when employment ends or access is determined inappropriate.,high,semantic,"HIPAA 164.308(a)(3)(ii)(C) requires procedures to terminate ePHI access when employment ends. CJIS 5.12.2 requires immediate termination of access to local agency systems when personnel are terminated. Both require prompt revocation of access upon personnel termination.",equal,10,5.12.2 Personnel Termination,5.12.2,Upon termination of personnel by an interface agency the agency shall immediately terminate access to local agency systems with access to CJI and provide notification to ensure access to state and other agency systems is terminated.,"Both require immediate termination of system access when personnel leave the organization. HIPAA covers ePHI systems; CJIS covers CJI systems with additional notification requirements for state systems."
164.308(a)(3)(ii)(C),Termination Procedures,Implement procedures for terminating access to ePHI when employment ends or access is determined inappropriate.,high,semantic,"HIPAA 164.308(a)(3)(ii)(C) requires termination procedures. CJIS 5.5.AC-2(3) requires disabling accounts within one week of inactivity termination or policy violation. Both require timely deactivation of accounts when access is no longer appropriate.",intersects_with,4,5.5.AC-2(3) Account Management | Disable Accounts,5.5.AC-2(3),"Disable accounts within one week when the accounts have expired, are no longer associated with a user, are in violation of organizational policy, or have been inactive for 90 calendar days.","HIPAA focuses on employment termination triggering access revocation; CJIS provides broader account disabling criteria including inactivity. Both ensure timely removal of access when no longer appropriate."
164.308(a)(4)(i),Information Access Management,Implement policies and procedures for authorizing access to ePHI consistent with applicable requirements.,high,semantic,"HIPAA 164.308(a)(4)(i) requires policies and procedures for authorizing access to ePHI. CJIS 5.5.AC-1 requires agency-level access control policy and procedures. Both require formal documented policies governing access authorization to sensitive information.",equal,10,5.5.AC-1 Policy and Procedures,5.5.AC-1,Develop document and disseminate to organizational personnel with access control responsibilities: agency-level access control policy that addresses purpose scope roles responsibilities management commitment coordination among organizational entities and compliance.,"Both require documented access control policies and procedures as the foundation for information access management. HIPAA specifies ePHI; CJIS specifies CJI."
164.308(a)(4)(i),Information Access Management,Implement policies and procedures for authorizing access to ePHI consistent with applicable requirements.,high,semantic,"HIPAA 164.308(a)(4)(i) requires information access management policies. CJIS 5.5.AC-3 requires enforcement of approved authorizations for logical access. Both require policies and technical controls ensuring only authorized individuals access sensitive information.",intersects_with,4,5.5.AC-3 Access Enforcement,5.5.AC-3,Enforce approved authorizations for logical access to information and system resources in accordance with applicable access control policies.,"HIPAA focuses on policy and procedural access management; CJIS AC-3 focuses on technical enforcement of access authorizations. HIPAA additionally covers administrative controls; CJIS additionally specifies technical enforcement mechanisms."
164.308(a)(4)(ii)(A),Isolation Health Clearinghouse Functions,Health clearinghouses must implement policies protecting ePHI from unauthorized access by the larger organization.,medium,semantic,"HIPAA 164.308(a)(4)(ii)(A) requires health clearinghouses to protect ePHI from unauthorized access by larger parent organizations through isolation policies. CJIS 5.10.SC-4 requires prevention of unauthorized and unintended information transfer via shared system resources. Both address isolation and separation of sensitive information from unauthorized access within shared or larger system environments.",intersects_with,3,5.10.SC-4 Information in Shared System Resources,5.10.SC-4,Prevent unauthorized and unintended information transfer via shared system resources.,"HIPAA focuses on organizational isolation of clearinghouse functions; CJIS focuses on technical isolation within shared system resources. HIPAA additionally covers administrative separation policies; CJIS additionally addresses object reuse and residual information."
