controlId,title,family,description,subFamily
EP.POID.V1,Point-of-Interaction devices managed,ENDPOINT SECURITY,"Implement procedures to securely manage all Point-of-Interaction (POI) devices (e.g., card payment devices) throughout their lifecycle, from deployment to decommissioning.To keep your payment devices safe:- Know your devices: Make an inventory of all your payment devices, including where they are located. Review this list every few months to make sure it's up to date.- Lock them down: Attach devices securely to counters so they can't be easily stolen and put tamper-evident stickers on device openings.- Check devices regularly: Look at each device daily for anything odd (like new attachments). Tell your staff to report anything suspicious right away.- Control who touches the devices: Only let authorized people install or fix devices. Always watch repair technicians when they work on devices.- Use strong passwords: Change the default password on every device and use unique, hard-to-guess passwords.- Train your team: Show everyone how to spot a tampered device and train them what to do if they see something suspicious.- Be careful when getting rid of old devices: Wipe all data from devices before throwing them away. Update your inventory accordingly.",ENDPOINT SECURITY
EP.PAR.V1,Privileged access rights,ENDPOINT SECURITY,The allocation and use of privileged access rights shall be restricted and managed.,ENDPOINT SECURITY
EP.ROA.V1,Return of assets,ENDPOINT SECURITY,"Personnel and other interested parties as appropriate shall return all the organization's assets in their possession upon change or termination of their employment, contract or agreement.",ENDPOINT SECURITY
EP.SDDP.V1,Secure device disposal process used,ENDPOINT SECURITY,"Implement and follow procedures for securely disposing of devices that contain organizational data. This ensures that sensitive information cannot be recovered from retired, damaged, or replaced devices.",ENDPOINT SECURITY
EP.SDOR.V1,Secure disposal or re-use of equipment,ENDPOINT SECURITY,Items of equipment containing storage media shall be verified to ensure that any sensitive data and licensed software has been removed or securely overwritten prior to disposal or re-use.,ENDPOINT SECURITY
EP.SOAO.V1,Security of assets off-premises,ENDPOINT SECURITY,Off-site assets shall be protected.,ENDPOINT SECURITY
EP.SIMF.V1,Software inventory for applications maintained,ENDPOINT SECURITY,"Establish and maintain an accurate, detailed, and up-to-date inventory of all licensed software installed for applications. This can be a link to a package or manifest file.",ENDPOINT SECURITY
EP.SIMO.V1,Software inventory on end-user devices maintained,ENDPOINT SECURITY,"Establish and maintain an accurate, detailed, and up-to-date inventory of all licensed software installed on enterprise assets, including end-user devices and servers.",ENDPOINT SECURITY
EP.SMC.V1,Storage media controls,ENDPOINT SECURITY,"Storage media shall be managed through their life cycle of acquisition, use, transportation and disposal in accordance with the organization's classification scheme and handling requirements.",ENDPOINT SECURITY
EP.SU.V1,Supporting utilities,ENDPOINT SECURITY,Information processing facilities shall be protected from power failures and other disruptions caused by failures in supporting utilities.,ENDPOINT SECURITY
EP.USRO.V1,Unauthorized software on end-user devices addressed and removed,ENDPOINT SECURITY,"Ensure that unauthorized software is either removed from use on enterprise assets or receives a documented exception. Review monthly, or more frequently based on risk level, to ensure software compliance with the organizational policy.",ENDPOINT SECURITY
EP.UFCM.V1,Unexpected file changes monitored,ENDPOINT SECURITY,"Set up a system to monitor unexpected changes to your important files and set up alerts when they happen.Create a list of your most important files. This should include things like system files, application files, configuration files, and log files. Review and update this list on a regular basis.Set up a file monitoring tool or intrusion detection tool with file monitoring capabilities. It should check all the important files on your list at least once a week. Configure it to send alerts immediately if it spots any unexpected changes. This could be changes to the file's content, or if files are added or deleted when they shouldn't be.Decide who on your team should receive these alerts and make sure they know what to do when they get one. Write down a clear procedure for how to investigate and respond to unexpected file changes. Keep records of all the alerts you receive and how you responded to them.Finally, check your file monitoring system at least once a month to make sure it's working as intended.",ENDPOINT SECURITY
EP.UWCD.V1,Unnecessary wireless capabilities disabled,ENDPOINT SECURITY,"Wireless networking capabilities that are not required for essential business or mission functions must be disabled on all devices to minimize security risks. Necessary wireless features, such as Wi-Fi or Bluetooth, must be configured securely to prevent unauthorized access.",ENDPOINT SECURITY
EP.UED.V1,User endpoint devices,ENDPOINT SECURITY,"Information stored on, processed by or accessible via user endpoint devices shall be protected.",ENDPOINT SECURITY
EP.WF.V1,Web filtering,ENDPOINT SECURITY,Access to external websites shall be managed to reduce exposure to malicious content.,ENDPOINT SECURITY
EP.WAPI.V1,Wireless access points identified and monitored,ENDPOINT SECURITY,"Test for the presence of all Wi-Fi access points at least once every three months and use tools or methods that can detect both authorized and unauthorized access points. If possible, use automated monitoring tools that can alert personnel when new access points are detected.Maintain an up-to-date list of all authorized wireless access points and document a business justification for each authorized access point. Regularly review and update this inventory.",ENDPOINT SECURITY
EP.WEC.V1,Wireless environments configured,ENDPOINT SECURITY,"Set up and manage your wireless network securely for both office and remote workers. Change default settings such as:- Change all default passwords on your wireless equipment (routers, access points).- Replace any pre-set encryption keys.- Update SNMP community strings if you use them.- Check your device manuals for any other default settings and change those too.Enable the strongest encryption your devices support (preferably WPA3 or at least WPA2) and use a long, complex password for the Wi-Fi network. Change it regularly and control access (e.g., use a separate guest network for visitors if possible).Regularly check for unauthorized devices on your network and train your employees accordingly.",ENDPOINT SECURITY
IS.ADTU.V1,Active discovery tools used,INFRASTRUCTURE SECURITY,"An active discovery tool is used to identify assets connected to the enterprise's network, configured to execute daily or more frequently.",INFRASTRUCTURE SECURITY
IS.AAR.V1,Administrator access restricted,INFRASTRUCTURE SECURITY,"Restrict administrator access to critical systems and sensitive data based on the principle of least privilege, granting elevated permissions only when necessary for specific tasks and revoking them promptly after completion. Implement strong authentication mechanisms, such as multi-factor authentication, and regularly review and update administrator access rights to ensure they align with job responsibilities and maintain a secure environment.",INFRASTRUCTURE SECURITY
IS.AMDO.V1,Anti-malware deployed on infrastructure,INFRASTRUCTURE SECURITY,Deploy anti-malware or antivirus solutions on infrastructure components such as servers and network devices. This helps detect and prevent malware infections and other malicious activities targeting critical systems.,INFRASTRUCTURE SECURITY
IS.ACR.V1,Application changes reviewed,INFRASTRUCTURE SECURITY,All proposed application changes are reviewed before they impact production.,INFRASTRUCTURE SECURITY
IS.ASSP.V1,Automated security scanning performed on infrastructure,INFRASTRUCTURE SECURITY,Automated security scanning software is deployed on all infrastructure components including servers and network devices.,INFRASTRUCTURE SECURITY
IS.ANCT.V1,Automatic network connection termination,INFRASTRUCTURE SECURITY,"Network connections associated with communication sessions must be automatically terminated at the end of the session or after a period of inactivity as defined in the Network Security Policy. This ensures that unused connections are not left open, reducing the risk of unauthorized access or misuse.",INFRASTRUCTURE SECURITY
IS.BNEP.V1,Buckets not exposed publicly,INFRASTRUCTURE SECURITY,Cloud storage buckets are not exposed to the public internet unless a documented business justification is in place.,INFRASTRUCTURE SECURITY
IS.CS.V1,Clock synchronization,INFRASTRUCTURE SECURITY,The clocks of information processing systems used by the organization shall be synchronized to approved time sources.,INFRASTRUCTURE SECURITY
IS.CSE.V1,Clock synchronization enforced,INFRASTRUCTURE SECURITY,"Enforce clock synchronization across all systems and devices within the organization's network using a reliable and accurate time source, such as Network Time Protocol (NTP) or Precision Time Protocol (PTP). Regularly monitor and audit system clocks to ensure they remain synchronized and promptly address any discrepancies to maintain the integrity of time-dependent processes, such as logging, authentication, and transaction processing.",INFRASTRUCTURE SECURITY
IS.CIU.V1,Cloud infrastructure used,INFRASTRUCTURE SECURITY,"Cloud infrastructure is hosted with providers that maintain independent certifications (e.g., SOC 2) for physical and environmental security controls, rather than managed on-premises.",INFRASTRUCTURE SECURITY
IS.CM.V1,Configuration management,INFRASTRUCTURE SECURITY,"Configurations, including security configurations, of hardware, software, services and networks shall be established, documented, implemented, monitored and reviewed.",INFRASTRUCTURE SECURITY
IS.CMSE.V1,Configuration management system established,INFRASTRUCTURE SECURITY,"Implement a configuration management system to manage and control the configuration of systems, applications, and infrastructure. Configuration management helps maintain consistency and security across the IT environment.",INFRASTRUCTURE SECURITY
IS.DFU.V1,DNS filtering used,INFRASTRUCTURE SECURITY,Utilize a DNS filtering service to protect against malicious domain requests and prevent access to known malicious websites.,INFRASTRUCTURE SECURITY
IS.FRPA.V1,Firewall restricts public access to infrastructure,INFRASTRUCTURE SECURITY,Firewalls are configured to restrict public access to the organization's infrastructure components.,INFRASTRUCTURE SECURITY
IS.HAIU.V1,High availability infrastructure used,INFRASTRUCTURE SECURITY,"Deploy high availability infrastructure across multiple availability zones or regions to ensure system redundancy and fault tolerance. Configure load balancing, automatic failover, and data replication mechanisms to minimize downtime and maintain uninterrupted service in the event of hardware, software, or network failures.",INFRASTRUCTURE SECURITY
IS.IFCP.V1,Information flow control policy established,INFRASTRUCTURE SECURITY,"Establish an information flow control policy to regulate the secure transmission of Controlled Unclassified Information (CUI) within and between systems, enforcing encryption, access controls, and boundary protections.",INFRASTRUCTURE SECURITY
IS.ISFU.V1,Information security for use of cloud services,INFRASTRUCTURE SECURITY,"Processes for acquisition, use, management and exit from cloud services shall be established in accordance with the organization's information security requirements.",INFRASTRUCTURE SECURITY
IS.ICL.V1,Infrastructure changes logged,INFRASTRUCTURE SECURITY,"Maintain a log of all infrastructure changes to track and document modifications made to critical systems and services. Logging infrastructure changes aids in audit trails, incident investigations, and accountability.",INFRASTRUCTURE SECURITY
IS.ICRR.V1,Infrastructure changes require review,INFRASTRUCTURE SECURITY,"Implement a review process for all proposed infrastructure changes before implementation. Reviews ensure that changes comply with security policies, do not introduce vulnerabilities, and align with the organization's requirements.",INFRASTRUCTURE SECURITY
IS.IDUI.V1,Infrastructure deployed using an infrastructure-as-code tool,INFRASTRUCTURE SECURITY,"Adopt an infrastructure-as-code (IaC) approach to deploy and manage the organization's infrastructure components. IaC tools enable consistent and version-controlled infrastructure deployment, reducing the risk of configuration errors.",INFRASTRUCTURE SECURITY
IS.IDSU.V1,Intrusion detection system used,INFRASTRUCTURE SECURITY,Utilize an intrusion detection system (IDS) to monitor network traffic and detect suspicious or unauthorized activities. IDS helps identify potential security breaches and intrusions in real-time.,INFRASTRUCTURE SECURITY
IS.KMPE.V1,Key management policy established,INFRASTRUCTURE SECURITY,"Establish a comprehensive key management policy that defines the processes for generating, storing, distributing, rotating, and revoking cryptographic keys used for data encryption, digital signatures, and secure communication. Ensure the key management policy aligns with industry best practices and regulatory requirements, and regularly review and update the policy to maintain its effectiveness in protecting the confidentiality, integrity, and availability of sensitive information.",INFRASTRUCTURE SECURITY
IS.LP.V1,Logging performed,INFRASTRUCTURE SECURITY,"Logs that record activities, exceptions, faults and other relevant events shall be produced, stored, protected and analysed.",INFRASTRUCTURE SECURITY
IS.NIST.V1,NIST 800-171 compliance policy established,INFRASTRUCTURE SECURITY,"Establish a compliance policy to govern access control, account authorization, data management, infrastructure security, and endpoint protection to ensure secure handling and protection of CUI.",INFRASTRUCTURE SECURITY
IS.NICU.V1,Network infrastructure continuously updated,INFRASTRUCTURE SECURITY,"Ensure the network infrastructure components (e.g., routers, switches, firewalls) are continuously updated with the latest security patches and firmware updates. Regular updates help address known vulnerabilities and enhance network security.",INFRASTRUCTURE SECURITY
IS.NSPE.V1,Network security policy established,INFRASTRUCTURE SECURITY,Develop and implement a network security policy that provides clear guidelines and requirements for securing your network infrastructure.,INFRASTRUCTURE SECURITY
IS.NS.V1,Networks security,INFRASTRUCTURE SECURITY,"Networks and network devices shall be secured, managed and controlled to protect information in systems and applications.",INFRASTRUCTURE SECURITY
IS.PPSM.V1,Payment page scripts managed,INFRASTRUCTURE SECURITY,"All scripts loaded and executed on payment pages in the consumer's browser must be authorized, integrity-assured, and inventoried with justification.Implement a method to authorize each payment page script and establish a process to confirm the integrity of each script. Maintain an inventory of all scripts with written justification for their necessity.Regularly review and update policies and procedures for managing payment page scripts.",INFRASTRUCTURE SECURITY
IS.PATE.V1,Production and test environments separated,INFRASTRUCTURE SECURITY,"Maintain separate, dedicated environments for testing and production systems, ensuring changes are thoroughly evaluated before implementation into the live production environment.",INFRASTRUCTURE SECURITY
IS.PDAR.V1,Production deployment access restricted,INFRASTRUCTURE SECURITY,Limit access to production deployment environments to authorized personnel only. This control helps prevent unauthorized changes or deployments that may disrupt critical services.,INFRASTRUCTURE SECURITY
IS.POIS.V1,Protection of information systems during audit testing,INFRASTRUCTURE SECURITY,Audit tests and other assurance activities involving assessment of operational systems shall be planned and agreed between the tester and appropriate management.,INFRASTRUCTURE SECURITY
IS.PRU.V1,Pull requests used,INFRASTRUCTURE SECURITY,Pull requests are used for code changes to ensure all modifications are reviewed before merging to production branches.,INFRASTRUCTURE SECURITY
IS.ROIP.V1,Redundancy of information processing facilities,INFRASTRUCTURE SECURITY,Information processing facilities shall be implemented with redundancy sufficient to meet availability requirements.,INFRASTRUCTURE SECURITY
IS.SONS.V1,Security of network services,INFRASTRUCTURE SECURITY,"Security mechanisms, service levels and service requirements of network services shall be identified, implemented and monitored.",INFRASTRUCTURE SECURITY
IS.SON.V1,Segregation of networks,INFRASTRUCTURE SECURITY,"Groups of information services, users and information systems shall be segregated in the organization's networks.",INFRASTRUCTURE SECURITY
IS.SASK.V1,Systems and software kept up to date,INFRASTRUCTURE SECURITY,"Automate and standardize the process of deploying software patches and updates to systems, software, and applications to ensure that critical security patches are applied promptly to address known vulnerabilities.",INFRASTRUCTURE SECURITY
IS.SSAT.V1,Systems segregated according to sensitivity of business function,INFRASTRUCTURE SECURITY,"Set up your systems so that different parts of your business operations are kept separate or well-protected from each other, especially when they have different security needs.In this context, a ""function"" is a specific business operation or process that your IT systems handle. For example:- Public website hosting- Employee email system- Customer database management- Payment processingIdentify your business operations and list out the key tasks your IT systems complete. Evaluate which functions need higher security and which need less. Separate them where possible (e.g., use different servers or cloud services for operations with different security needs). If you can't physically separate use virtualization to create separate environments on the same machine.Secure everything to the level of the most sensitive function.Document your setup by creating a diagram showing which business operations are on which systems. Explain how you've separated or secured different operations.",INFRASTRUCTURE SECURITY
IS.UAR.V1,Unauthorized assets addressed and removed,INFRASTRUCTURE SECURITY,Ensure that a process exists to address unauthorized assets on a periodic basis. This process should include regular audits of all assets and a procedure for handling unauthorized assets when they are discovered.,INFRASTRUCTURE SECURITY
IS.UPDA.V1,Unique production database authentication enforced,INFRASTRUCTURE SECURITY,"Enforce unique authentication mechanisms for accessing production databases, such as a unique username and password or SSH key.",INFRASTRUCTURE SECURITY
IS.UOC.V1,Use of cryptography,INFRASTRUCTURE SECURITY,"Rules for the effective use of cryptography, including cryptographic key management, shall be defined and implemented.",INFRASTRUCTURE SECURITY
IS.VU.V1,VPN used,INFRASTRUCTURE SECURITY,"Utilize Virtual Private Network (VPN) connections to secure remote communications between users and the organization's internal network. VPNs provide encrypted and authenticated tunnels, ensuring secure data transmission over untrusted networks.",INFRASTRUCTURE SECURITY
IS.WAFU.V1,Web Application Firewall (WAF) used,INFRASTRUCTURE SECURITY,"Implement a Web Application Firewall (WAF) to protect web applications from various cyber threats, such as SQL injection, cross-site scripting, and other application-layer attacks.",INFRASTRUCTURE SECURITY
MI.ASME.V1,AI system monitoring established,MONITORING AND INCIDENT_RESPONSE,"Establish ongoing monitoring of AI systems to track performance, detect issues, identify drift, and ensure continued safe and effective operation in production.",MONITORING AND INCIDENT_RESPONSE
MI.AALS.V1,Adequate audit log storage maintained,MONITORING AND INCIDENT_RESPONSE,Ensure sufficient storage capacity to retain audit logs for the required duration. Adequate audit log storage enables historical analysis and supports compliance requirements related to log retention.,MONITORING AND INCIDENT_RESPONSE
MI.AADO.V1,Assessment and decision on information security events,MONITORING AND INCIDENT_RESPONSE,The organization shall assess information security events and decide if they are to be categorized as information security incidents.,MONITORING AND INCIDENT_RESPONSE
MI.ALMP.V1,Audit log management process maintained,MONITORING AND INCIDENT_RESPONSE,"Maintain a robust and up-to-date audit log management process. This process should include guidelines for capturing, storing, and monitoring audit logs, ensuring the availability and integrity of essential security event data.",MONITORING AND INCIDENT_RESPONSE
MI.ALC.V1,Audit logs collected,MONITORING AND INCIDENT_RESPONSE,"Enable the collection of audit logs from critical systems and applications. Audit logs capture essential security events and activities, providing valuable information for incident detection, investigation, and compliance purposes.",MONITORING AND INCIDENT_RESPONSE
MI.BNPE.V1,Breach notification process established,MONITORING AND INCIDENT_RESPONSE,"Establish a breach notification process that outlines the organization's procedures for detecting, assessing, and reporting security breaches. This process helps ensure timely and effective incident response.",MONITORING AND INCIDENT_RESPONSE
MI.BNTP.V1,Breach notification template prepared,MONITORING AND INCIDENT_RESPONSE,"Develop and maintain a standardized breach notification template to provide timely, consistent, and compliant communication with affected individuals in the event of a breach.",MONITORING AND INCIDENT_RESPONSE
MI.BRPE.V1,Breach response playbook established,MONITORING AND INCIDENT_RESPONSE,"Develop and maintain a breach response playbook focused on managing breaches after they are discovered, including detailed procedures for assessing, containing, and resolving incidents involving protected information.",MONITORING AND INCIDENT_RESPONSE
MI.BRAT.V1,Breach risk assessment template developed,MONITORING AND INCIDENT_RESPONSE,Establish a standardized risk assessment template to evaluate the potential impact of breaches on affected individuals. Include criteria for assessing:- The nature and sensitivity of the breached ePHI.- The likelihood of data misuse.- Steps already taken to mitigate the breach.,MONITORING AND INCIDENT_RESPONSE
MI.CMPD.V1,Compliance monitoring processes defined and implemented,MONITORING AND INCIDENT_RESPONSE,Define and implement comprehensive compliance monitoring processes to evaluate the performance and effectiveness of the information security management system (ISMS).,MONITORING AND INCIDENT_RESPONSE
MI.CSCS.V1,Critical security control systems monitored,MONITORING AND INCIDENT_RESPONSE,"Your security tools are like the alarm system for your business. If they stop working and you don't notice, you're leaving the door wide open for attackers. By catching and fixing problems fast, you keep your defenses strong and your customer data safe.Make a list of your key security tools, including:- Firewalls and other network security controls- Intrusion detection/prevention systems (IDS/IPS)- Anti-malware software- Systems that detect changes to important files- Physical access controls (like door locks)- Login systems- Tools that record system activities (audit logs)- Any tools that separate different parts of your network (segmentation controls)Configure each system to send out an alert if it stops working properly and make sure these alerts go to the right people who can fix the problem. Include this in the incident response plan for each type of security system.Regularly test your alert system to make sure it's working and maintain records for each security system failure.",MONITORING AND INCIDENT_RESPONSE
MI.DORT.V1,Digital operational resilience testing program defined,MONITORING AND INCIDENT_RESPONSE,"Define a comprehensive testing program to evaluate your digital operational resilience across ICT systems and critical functions. Ensure the scope of the resilience testing program includes all critical ICT assets, systems, and processes. Set objectives for testing key resilience aspects such as incident response, disaster recovery, and business continuity.Determine appropriate testing methods, including tabletop exercises, penetration testing, vulnerability assessments, and full-scale simulations. Schedule tests regularly, ensuring they reflect the criticality and risk profile of each asset or service.Analyze testing outcomes to identify areas for improvement and update security and resilience controls accordingly. Document action plans to address any identified gaps and implement corrective actions.",MONITORING AND INCIDENT_RESPONSE
MI.HHSB.V1,HHS breach reporting template established,MONITORING AND INCIDENT_RESPONSE,"Prepare a standardized reporting template for notifying the Department of Health and Human Services (HHS) of breaches, including required elements for both small and large breaches.",MONITORING AND INCIDENT_RESPONSE
MI.IRFB.V1,ICT readiness for business continuity,MONITORING AND INCIDENT_RESPONSE,"ICT readiness shall be planned, implemented, maintained and tested based on business continuity objectives and ICT continuity requirements.",MONITORING AND INCIDENT_RESPONSE
