controlId,title,family,description,subFamily
AC.AC.V1,Access control,ACCESS CONTROL AND AUTHORIZATION,Rules to control physical and logical access to information and other associated assets shall be established and implemented based on business and information security requirements.,ACCESS CONTROL AND AUTHORIZATION
AC.AGPU.V1,Access granting process used,ACCESS CONTROL AND AUTHORIZATION,"Implement a formal access granting process that ensures new access privileges are assigned based on the principle of least privilege, and require at least one employee to endorse the granting of new access.",ACCESS CONTROL AND AUTHORIZATION
AC.AMPE.V1,Access management policy established,ACCESS CONTROL AND AUTHORIZATION,"Systematic controls are established in the access management policy for managing user access rights, ensuring appropriate, authorized access to systems and data.",ACCESS CONTROL AND AUTHORIZATION
AC.ARSD.V1,Access requests to sensitive data required,ACCESS CONTROL AND AUTHORIZATION,"To access sensitive data, employees must submit access requests that are approved and monitored.",ACCESS CONTROL AND AUTHORIZATION
AC.ARSI.V1,Access requests to sensitive infrastructure required,ACCESS CONTROL AND AUTHORIZATION,"To access sensitive infrastructure components, employees must submit access requests that are approved and monitored. This control helps ensure that only authorized personnel can access critical infrastructure, minimizing potential risks.",ACCESS CONTROL AND AUTHORIZATION
AC.ARPE.V1,Access revoking process enforced,ACCESS CONTROL AND AUTHORIZATION,Implement a regular access review process to promptly remove access privileges from employees who no longer require them. This ensures that former employees or users do not retain unauthorized access to organizational resources.,ACCESS CONTROL AND AUTHORIZATION
AC.AR.V1,Access rights,ACCESS CONTROL AND AUTHORIZATION,"Access rights to information and other associated assets shall be provisioned, reviewed, modified and removed in accordance with the organization's topic-specific policy on and rules for access control.",ACCESS CONTROL AND AUTHORIZATION
AC.ATSC.V1,Access to source code,ACCESS CONTROL AND AUTHORIZATION,"Read and write access to source code, development tools and software libraries shall be appropriately managed.",ACCESS CONTROL AND AUTHORIZATION
AC.AIM.V1,Account inventory maintained,ACCESS CONTROL AND AUTHORIZATION,"An inventory of user accounts on critical and high-risk vendors that have access to in-scope systems and services is maintained, including essential details such as account owners, access privileges, associated roles, and vendor relationships where applicable. The inventory is reviewed and updated at least annually.",ACCESS CONTROL AND AUTHORIZATION
AC.ALAR.V1,Audit log access restricted,ACCESS CONTROL AND AUTHORIZATION,"Ensure audit information and audit logging tools are safeguarded against unauthorized access, modification, and deletion. In order to maintain the integrity and reliability of audit information, access to audit logging functionality must be restricted to a limited subset of privileged users or roles that have an explicit business need.",ACCESS CONTROL AND AUTHORIZATION
AC.AI.V1,Authentication information,ACCESS CONTROL AND AUTHORIZATION,"Allocation and management of authentication information shall be controlled by a management process, including advising personnel on the appropriate handling of authentication information.",ACCESS CONTROL AND AUTHORIZATION
AC.AIAP.V1,Authenticators initially and periodically tested,ACCESS CONTROL AND AUTHORIZATION,Initially and periodically test devices (tokens/cards) that bear or generate identification code/password information to ensure proper function and no unauthorized alteration.,ACCESS CONTROL AND AUTHORIZATION
AC.ADAP.V1,Automated decision-making and profiling has oversight,ACCESS CONTROL AND AUTHORIZATION,"This requirements establishes safeguards for automated decision-making processes, including profiling, to align with GDPR requirements and protect data subjects' rights.",ACCESS CONTROL AND AUTHORIZATION
AC.AULE.V1,Automatic user logoff enforced,ACCESS CONTROL AND AUTHORIZATION,Implement an automatic logoff mechanism to terminate user sessions after a period of inactivity.,ACCESS CONTROL AND AUTHORIZATION
AC.AUST.V1,Automatic user session termination enforced,ACCESS CONTROL AND AUTHORIZATION,"User sessions must be automatically terminated all defined events outlined in the Compliance NIST 800-171 Policy. Conditions may include inactivity for a specified period (e.g., 15 minutes), time-of-day restrictions on access, and responses to suspicious activity or security incidents. Automatic session termination ensures system security by ending processes associated with the user's logical session.",ACCESS CONTROL AND AUTHORIZATION
AC.BSUE.V1,Biometric signature uniqueness ensured,ACCESS CONTROL AND AUTHORIZATION,Design biometric‑based signatures so they cannot be used by anyone other than the genuine owner.,ACCESS CONTROL AND AUTHORIZATION
AC.CTPH.V1,Changes to PHI logged,ACCESS CONTROL AND AUTHORIZATION,"Track all changes made to PHI, including additions, modifications, and deletions, to ensure data integrity and enable audit trails.",ACCESS CONTROL AND AUTHORIZATION
AC.CLRE.V1,Credential loss response executed,ACCESS CONTROL AND AUTHORIZATION,Follow loss‑management procedures to deauthorize lost/stolen/missing tokens or devices and issue replacements under rigorous controls.,ACCESS CONTROL AND AUTHORIZATION
AC.DAAU.V1,Dedicated administrator accounts used,ACCESS CONTROL AND AUTHORIZATION,"Restrict administrator privileges to dedicated administrator accounts on enterprise assets. Conduct general computing activities, such as internet browsing, email, and productivity suite use, from the user’s primary, non-privileged account.",ACCESS CONTROL AND AUTHORIZATION
AC.DAD.V1,Default accounts disabled,ACCESS CONTROL AND AUTHORIZATION,"Disable default accounts on enterprise assets and software, such as root, administrator, and other pre-configured vendor accounts, where possible. Example implementations can include: disabling default accounts or making them unusable.",ACCESS CONTROL AND AUTHORIZATION
AC.DAD.V1,Dormant accounts disabled,ACCESS CONTROL AND AUTHORIZATION,Monitor for dormant user accounts and disable or remove accounts that have been inactive for an extended period.,ACCESS CONTROL AND AUTHORIZATION
AC.ESCM.V1,Electronic signature components managed,ACCESS CONTROL AND AUTHORIZATION,Require multi‑factor or multi-component e‑signature mechanisms for non‑biometric systems.,ACCESS CONTROL AND AUTHORIZATION
AC.EAPE.V1,Emergency access procedure established,ACCESS CONTROL AND AUTHORIZATION,Establish and maintain a procedure for granting authorized personnel access to critical information during emergencies.,ACCESS CONTROL AND AUTHORIZATION
AC.EARR.V1,Employee access regularly reviewed,ACCESS CONTROL AND AUTHORIZATION,Employee access is reviewed at least annually to ensure that access privileges are appropriate and that former employees or users do not retain unauthorized access.,ACCESS CONTROL AND AUTHORIZATION
AC.IAMI.V1,IAM Inventory Maintained,ACCESS CONTROL AND AUTHORIZATION,"Maintain a centralized inventory of all individuals, groups, roles, services, and devices with access to organizational systems.",ACCESS CONTROL AND AUTHORIZATION
AC.IM.V1,Identity management,ACCESS CONTROL AND AUTHORIZATION,The full life cycle of identities shall be managed.,ACCESS CONTROL AND AUTHORIZATION
AC.IAR.V1,Information access restriction,ACCESS CONTROL AND AUTHORIZATION,Access to information and other associated assets shall be restricted in accordance with the established topic-specific policy on access control.,ACCESS CONTROL AND AUTHORIZATION
AC.KIM.V1,Key inventory maintained,ACCESS CONTROL AND AUTHORIZATION,"Maintain an inventory of all shared or production access tokens to ensure proper management, tracking, and security of our key assets.",ACCESS CONTROL AND AUTHORIZATION
AC.MRFA.V1,MFA required for administrative access,ACCESS CONTROL AND AUTHORIZATION,Require multi-factor authentication (MFA) for administrative access to critical systems and services. MFA mitigates the risk of unauthorized administrative access and helps protect sensitive administrative functions.,ACCESS CONTROL AND AUTHORIZATION
AC.MUOA.V1,MFA required for applications,ACCESS CONTROL AND AUTHORIZATION,"Require all externally-exposed enterprise or third-party applications to enforce MFA, where supported. Enforcing MFA through a directory service or SSO provider is a satisfactory implementation of this safeguard.",ACCESS CONTROL AND AUTHORIZATION
AC.MRFC.V1,MFA required for critical services,ACCESS CONTROL AND AUTHORIZATION,Multi-factor authentication (MFA) is required for accessing critical services and infrastructure unless a documented exception is in place where MFA is not supported.,ACCESS CONTROL AND AUTHORIZATION
AC.MRFI.V1,MFA required for infrastructure access,ACCESS CONTROL AND AUTHORIZATION,Require multi-factor authentication (MFA) for accessing sensitive infrastructure. MFA adds an extra layer of security by requiring users to provide additional authentication factors beyond their passwords.,ACCESS CONTROL AND AUTHORIZATION
AC.MRFN.V1,MFA required for network access,ACCESS CONTROL AND AUTHORIZATION,Require multi-factor authentication (MFA) for accessing the organization's network. MFA strengthens network security by requiring users to provide additional authentication factors during login attempts.,ACCESS CONTROL AND AUTHORIZATION
AC.MCPE.V1,Maintenance control process established,ACCESS CONTROL AND AUTHORIZATION,Establish a process to approve and monitor maintenance and diagnostic activities requiring remote network access to manage or maintain systems—this encompasses all maintenance activities for applications hosted on a cloud provider.,ACCESS CONTROL AND AUTHORIZATION
AC.MPAP.V1,Maintenance personnel authorization process established,ACCESS CONTROL AND AUTHORIZATION,Establish a process for authorizing maintenance personnel and organizations to ensure only qualified and authorized individuals perform maintenance on the system. Verify access authorizations for non-escorted personnel and designate authorized personnel to supervise maintenance activities when required.,ACCESS CONTROL AND AUTHORIZATION
AC.MTMA.V1,Maintenance tools managed and secured,ACCESS CONTROL AND AUTHORIZATION,"Implement a process to approve, control, and monitor the use of system maintenance tools, ensuring they are free from malicious code and do not compromise the security of CUI. Additionally, prevent unauthorized removal of system maintenance equipment containing CUI by sanitizing, retaining, or securely destroying such equipment as outlined in the Asset Management Policy.",ACCESS CONTROL AND AUTHORIZATION
AC.PEAR.V1,Password expiration and renewal enforced,ACCESS CONTROL AND AUTHORIZATION,"Periodically check, recall, or revise identification codes and passwords (e.g., password aging) to maintain security and integrity.",ACCESS CONTROL AND AUTHORIZATION
AC.PMPE.V1,Password management policy enforced,ACCESS CONTROL AND AUTHORIZATION,"Strictly enforce the organization’s password management policy to guarantee compliance with security standards. Enforcing this policy includes implementing technical controls, monitoring adherence, and responding to non-compliance.",ACCESS CONTROL AND AUTHORIZATION
AC.PMPE.V1,Password management policy established,ACCESS CONTROL AND AUTHORIZATION,"Enforce a password management policy that mandates strong and complex passwords, and prohibits the reuse of previously used passwords. This policy helps protect user accounts from unauthorized access due to weak or compromised passwords.",ACCESS CONTROL AND AUTHORIZATION
AC.SA.V1,Secure authentication,ACCESS CONTROL AND AUTHORIZATION,Secure authentication technologies and procedures shall be implemented based on information access restrictions and the topic-specific policy on access control.,ACCESS CONTROL AND AUTHORIZATION
AC.SDCS.V1,Signature during continuous session captured,ACCESS CONTROL AND AUTHORIZATION,"For a series of signings in a single, continuous, controlled session: require full credentials for the first signing; allow subsequent signings with at least one component (e.g., PIN) that only the individual can execute.",ACCESS CONTROL AND AUTHORIZATION
AC.SOCS.V1,Signature outside continuous session captured,ACCESS CONTROL AND AUTHORIZATION,"When signings are not in a single continuous session, require all electronic signature components for each signing.",ACCESS CONTROL AND AUTHORIZATION
AC.UICM.V1,Unique identification codes managed,ACCESS CONTROL AND AUTHORIZATION,Manage IDs/passwords securely with lifecycle controls to prevent misuse.,ACCESS CONTROL AND AUTHORIZATION
AC.USIA.V1,Unique signature identification assigned,ACCESS CONTROL AND AUTHORIZATION,"Ensure each e‑signature is unique, non‑transferable, and tied to one individual.",ACCESS CONTROL AND AUTHORIZATION
AC.UUII.V1,Unique user identification implemented,ACCESS CONTROL AND AUTHORIZATION,"Enforce the use of unique user identification for all individuals and systems accessing environments where protected information is stored, processed, or transmitted.",ACCESS CONTROL AND AUTHORIZATION
AC.URTG.V1,Use restricted to genuine owners,ACCESS CONTROL AND AUTHORIZATION,Ensure electronic signatures (non‑biometric) are used only by their genuine owners.,ACCESS CONTROL AND AUTHORIZATION
DM.ADGE.V1,AI data governance established,DATA MANAGEMENT AND PROTECTION,"Establish and maintain data governance processes for AI systems covering data acquisition, quality, provenance, preparation, and lifecycle management.",DATA MANAGEMENT AND PROTECTION
DM.ADLT.V1,AI data lineage tracked,DATA MANAGEMENT AND PROTECTION,"Track and document data lineage throughout the AI system lifecycle, including data origin, transformations, usage, and flow from source to AI model outputs.",DATA MANAGEMENT AND PROTECTION
DM.ADQA.V1,AI data quality assessment performed,DATA MANAGEMENT AND PROTECTION,"Assess and ensure the quality of data used for AI systems meets defined requirements for accuracy, completeness, consistency, and fitness for purpose.",DATA MANAGEMENT AND PROTECTION
DM.AMVP.V1,AI model validation performed,DATA MANAGEMENT AND PROTECTION,"Validate AI models to ensure they meet intended objectives, perform as expected in real-world conditions, and are fit for their intended purpose and use cases.",DATA MANAGEMENT AND PROTECTION
DM.ASDP.V1,AI system development process established,DATA MANAGEMENT AND PROTECTION,"Define and document processes for the responsible design, development, verification, validation, and deployment of AI systems throughout their lifecycle.",DATA MANAGEMENT AND PROTECTION
DM.ASTP.V1,AI system testing performed,DATA MANAGEMENT AND PROTECTION,"Perform comprehensive testing of AI systems to verify they meet specifications, function correctly, and are secure and reliable throughout their lifecycle.",DATA MANAGEMENT AND PROTECTION
DM.AUOI.V1,Acceptable use of information and other associated assets,DATA MANAGEMENT AND PROTECTION,"Rules for the acceptable use and procedures for handling information and other associated assets shall be identified, documented and implemented.",DATA MANAGEMENT AND PROTECTION
DM.ARHW.V1,Automated Request Handling Workflow,DATA MANAGEMENT AND PROTECTION,"Establish an automated workflow for handling consumer privacy requests in compliance with the CCPA. The system captures, validates, and routes requests—such as access, deletion, or opt-out of sale—ensuring timely and accurate processing. Audit trails and reporting capabilities are maintained to demonstrate compliance and support ongoing monitoring and remediation.",DATA MANAGEMENT AND PROTECTION
DM.COI.V1,Classification of information,DATA MANAGEMENT AND PROTECTION,"Information shall be classified according to the information security needs of the organization based on confidentiality, integrity, availability and relevant interested party requirements.",DATA MANAGEMENT AND PROTECTION
DM.CLTN.V1,Clear Link to Not Share Information,DATA MANAGEMENT AND PROTECTION,"This control ensures that the website homepage includes clear and accessible links titled “Do Not Sell or Share My Personal Information” and “Limit the Use of My Sensitive Personal Information” in compliance with the California Consumer Privacy Act (CCPA) and its amendments (CPRA). These links allow consumers to easily exercise their rights to opt out of the sale or sharing of their personal data and to restrict the use of sensitive personal information. The control verifies that the links are prominently displayed, functional, and direct users to appropriate mechanisms or preference centers for submitting their requests.",DATA MANAGEMENT AND PROTECTION
DM.COND.V1,Collect Only Necessary Data,DATA MANAGEMENT AND PROTECTION,"Collect only the personal information necessary to fulfill its stated business purposes, in alignment with CCPA principles. Data minimization practices are applied across all collection points to limit exposure and reduce privacy risks. Regular reviews are conducted to ensure that unnecessary data is not captured or retained, supporting compliance and responsible data handling.",DATA MANAGEMENT AND PROTECTION
DM.CFMC.V1,Compliance for multiple covered functions managed,DATA MANAGEMENT AND PROTECTION,Entities performing multiple covered functions must establish clear processes to ensure each function adheres to its specific standards and requirements.,DATA MANAGEMENT AND PROTECTION
DM.CPIA.V1,Conduct Privacy Impact Assessments for New Processes,DATA MANAGEMENT AND PROTECTION,"The organization must conduct privacy impact assessments (PIAs) for new processes being introduced to the data flow. Some example processes may be introducing a new plan for marketing emails, introducing a new payment processor, or introducing a new system for data analytics. This document should be approved by the privacy officer before action takes place.",DATA MANAGEMENT AND PROTECTION
DM.CCCC.V1,Confidential customer communication channel created,DATA MANAGEMENT AND PROTECTION,Establish and maintain a secure communication channel for all customer interactions involving protected information.,DATA MANAGEMENT AND PROTECTION
DM.CFCA.V1,Consent for collecting and managing data obtained,DATA MANAGEMENT AND PROTECTION,"Implement a consent mechanism that is freely given, specific, informed, and unambiguous. The consent requests must be clearly distinguishable from other matters, in an easily accessible form, using clear and simple language. For sensitive data, obtain explicit consent unless another exception applies.Maintain a record of obtained consents, including what the data subject has consented to and when.Regularly review and renew consents, especially if your purposes for processing change.Do not make services conditional on consent unless the data is necessary for that service.",DATA MANAGEMENT AND PROTECTION
DM.CATM.V1,Cookie And Tracker Management,DATA MANAGEMENT AND PROTECTION,"This control requires the implementation of a Cookie and Tracker Management Platform (CMP) to manage user consent for cookies and tracking technologies in compliance with CCPA and related privacy regulations. The CMP collects, records, and enforces user preferences for data collection, sharing, and marketing purposes. It also provides mechanisms for users to review and update their consent, while maintaining audit logs to demonstrate regulatory compliance.",DATA MANAGEMENT AND PROTECTION
DM.CRDP.V1,Criminal record data processing managed,DATA MANAGEMENT AND PROTECTION,"If you process any data related to criminal convictions or offenses, verify that you have the legal authority to process this data.Implement strict access controls and security measures for this sensitive data. Document your legal basis and safeguards for processing criminal record data.Make sure you're not maintaining a comprehensive register of criminal convictions unless under official authority.",DATA MANAGEMENT AND PROTECTION
DM.CKLM.V1,Cryptographic key lifecycle managed,DATA MANAGEMENT AND PROTECTION,"Develop and document detailed key management policies and procedures covering the entire key lifecycle, including:- Implement secure key generation processes using strong cryptographic algorithms.- Establish secure methods for key distribution and storage.- Define and enforce key usage policies, including access controls and key rotation schedules.- Implement processes for secure key backup and recovery.- Establish procedures for key revocation, replacement, and destruction when necessary.- Implement split knowledge and dual control for manual cleartext key operations.- Prevent unauthorized substitution of cryptographic keys.- Require formal acknowledgment of responsibilities from key custodians.Regularly review and update key management practices to align with industry standards.",DATA MANAGEMENT AND PROTECTION
DM.CKAA.V1,Cryptographic keys and application secrets secured,DATA MANAGEMENT AND PROTECTION,"Implement and maintain robust procedures to securely manage cryptographic keys and application secrets used for protecting sensitive data throughout their lifecycle.Develop and document a comprehensive key management policy and procedures, including:- Implement secure key generation processes using industry-standard algorithms and random number generators.- Establish secure key storage mechanisms, such as hardware security modules (HSMs) or encrypted key stores.- Enforce strict access controls to limit key/secret access to authorized personnel only.- Implement key rotation and expiration policies to minimize the impact of potential key compromises.- Set up secure key/secret distribution and transmission processes.- Establish and maintain an inventory of all cryptographic keys and their purposes.- Implement secure key/secret backup and recovery procedures.- Ensure proper destruction of retired or compromised keys and secrets.Regularly review and update key management practices to align with current industry standards and best practices.",DATA MANAGEMENT AND PROTECTION
DM.DDE.V1,Data deletion enforced,DATA MANAGEMENT AND PROTECTION,"Implement and maintain procedures to securely delete data when it is no longer needed, in compliance with data protection regulations and company policies.",DATA MANAGEMENT AND PROTECTION
DM.DEU.V1,Data encrypted at rest,DATA MANAGEMENT AND PROTECTION,All sensitive data is encrypted when stored on systems or devices.,DATA MANAGEMENT AND PROTECTION
DM.ADEI.V1,Data encrypted in-transit,DATA MANAGEMENT AND PROTECTION,"All data is encrypted when transmitted over networks, both within the organization's internal network and external connections.",DATA MANAGEMENT AND PROTECTION
DM.DIM.V1,Data inventory maintained,DATA MANAGEMENT AND PROTECTION,"Establish and maintain an accurate, detailed, and up-to-date inventory of all data assets. This can include data stored in databases, file shares, and cloud storage.",DATA MANAGEMENT AND PROTECTION
DM.DLAT.V1,Data labeled according to classification level,DATA MANAGEMENT AND PROTECTION,All data is labeled based on its classification level. This ensures that appropriate access controls and handling procedures are applied to protect information.,DATA MANAGEMENT AND PROTECTION
DM.DLP.V1,Data leakage prevention,DATA MANAGEMENT AND PROTECTION,"Data leakage prevention measures shall be applied to systems, networks and any other devices that process, store or transmit sensitive information.",DATA MANAGEMENT AND PROTECTION
DM.DMAR.V1,Data management and retention policy established,DATA MANAGEMENT AND PROTECTION,"A data management and retention policy is established, outlining guidelines for how long data should be retained and how it should be managed throughout its lifecycle.",DATA MANAGEMENT AND PROTECTION
DM.DM.V1,Data masking,DATA MANAGEMENT AND PROTECTION,"Data masking shall be used in accordance with the organization's topic-specific policy on access control and other related topic-specific policies, and business requirements, taking applicable legislation into consideration.",DATA MANAGEMENT AND PROTECTION
DM.DMU.V1,Data masking procedures used,DATA MANAGEMENT AND PROTECTION,"Implement data masking procedures to replace sensitive or personally identifiable information with fictitious but realistic data. Ensure data masking is applied consistently across all non-production environments, such as development, testing, and training systems, to protect the confidentiality of sensitive data.",DATA MANAGEMENT AND PROTECTION
DM.DPIA.V1,Data processing integrity and output validated,DATA MANAGEMENT AND PROTECTION,"Define and establish quality control measures to verify the completeness, accuracy, and timeliness of your output. This can look like implementing automated data validation checks, setting up data reconciliation processes, establishing review and approval workflows for critical outputs, creating data quality dashboards for real-time monitoring, and implementing version control systems for data processing scripts. Set up real-time monitoring of these measures and create error logs and incident reports where applicable.",DATA MANAGEMENT AND PROTECTION
DM.EDRP.V1,Data retention policy enforced,DATA MANAGEMENT AND PROTECTION,"The data retention policy is actively enforced, ensuring that data is retained for the appropriate duration and disposed of securely when it reaches the end of its retention period.",DATA MANAGEMENT AND PROTECTION
