controlId,title,family,description,subFamily
DM.DTME.V1,Data transfer mechanisms established,DATA MANAGEMENT AND PROTECTION,"Establish proper data transfer mechanisms to protect personal data when it's transferred across borders or to third parties.Identify all instances where personal data is transferred outside your organization or to different jurisdictions. Assess the adequacy of data protection measures in recipient countries or organizations.Implement appropriate transfer mechanisms (e.g., standard contractual clauses, binding corporate rules) based on the nature of the transfer and the recipient.Establish processes to regularly review and update transfer mechanisms as regulatory requirements or organizational practices change. Maintain documentation of all data transfer arrangements and their legal bases.",DATA MANAGEMENT AND PROTECTION
DM.DPFP.V1,De-identification process for PHI established,DATA MANAGEMENT AND PROTECTION,Establish and implement a documented process for de-identifying protected health information (PHI) to comply with HIPAA requirements and enable the use or disclosure of data without patient authorization if required.,DATA MANAGEMENT AND PROTECTION
DM.IRTC.V1,Establish Right-To-Correct Request Handling,DATA MANAGEMENT AND PROTECTION,"The organization must configure a system to handle Right-to-correct management. Under CCPA, the user has a right to have their inaccurate data corrected upon request.",DATA MANAGEMENT AND PROTECTION
DM.EPIM.V1,External privacy inquiries managed,DATA MANAGEMENT AND PROTECTION,"Establish and maintain a system for handling all privacy-related inquiries, including general questions, complaints, disputes, and specific requests for personal information access and correction.",DATA MANAGEMENT AND PROTECTION
DM.FDDP.V1,Facility directory disclosure process established,DATA MANAGEMENT AND PROTECTION,"Establish and maintain a documented process for including protected health information (PHI) in facility directories, ensuring individuals are informed and given the opportunity to agree or object to such disclosures.",DATA MANAGEMENT AND PROTECTION
DM.FCNP.V1,Full card numbers protected and hidden,DATA MANAGEMENT AND PROTECTION,"Implement different measures to protect full card numbers (i.e. PANs) such as hiding most of the number on screens and receipts with something like asterisks (\*\*\*\*\*\*\*). Establish a list of job roles who need full access, including a rationale why this is the case.Set up your payment system so that it only shows full numbers to people on your access list. Be extra careful with remote access and set up controls to only let those with a real business need copy card numbers.Train your staff accordingly. Review access rights to full card numbers regularly and check your system configurations.",DATA MANAGEMENT AND PROTECTION
DM.HGPC.V1,Honor Global Privacy Control (GPC) Signals,DATA MANAGEMENT AND PROTECTION,Detect and honor Global Privacy Control (GPC) signals from users’ browsers or devices in accordance with CCPA requirements. It automatically respects users’ preferences to opt out of the sale or sharing of their personal information. The control also logs and monitors signal processing to maintain compliance and provide evidence of adherence to consumer privacy requests.,DATA MANAGEMENT AND PROTECTION
DM.IB.V1,Information backup,DATA MANAGEMENT AND PROTECTION,"Backup copies of information, software and systems shall be maintained and regularly tested in accordance with the agreed topic-specific policy on backup.",DATA MANAGEMENT AND PROTECTION
DM.ID.V1,Information deletion,DATA MANAGEMENT AND PROTECTION,"Information stored in information systems, devices or in any other storage media shall be deleted when no longer required.",DATA MANAGEMENT AND PROTECTION
DM.IT.V1,Information transfer,DATA MANAGEMENT AND PROTECTION,"Information transfer rules, procedures, or agreements shall be in place for all types of transfer facilities within the organization and between the organization and other parties.",DATA MANAGEMENT AND PROTECTION
DM.IVU.V1,Input validation used,DATA MANAGEMENT AND PROTECTION,Implement input validation checks across all system interfaces to ensure data completeness and accuracy before processing. These checks should verify that data meets specified format requirements and business rules.,DATA MANAGEMENT AND PROTECTION
DM.KMPI.V1,Key management process implemented,DATA MANAGEMENT AND PROTECTION,Implement a key management system covering the entire lifecycle of cryptographic keys.,DATA MANAGEMENT AND PROTECTION
DM.LOI.V1,Labelling of information,DATA MANAGEMENT AND PROTECTION,An appropriate set of procedures for information labelling shall be developed and implemented in accordance with the information classification scheme adopted by the organization.,DATA MANAGEMENT AND PROTECTION
DM.MROP.V1,Maintain Record of Processing Activities,DATA MANAGEMENT AND PROTECTION,The organization must maintain a comprehensive and regularly updated record of all personal information processing activities to demonstrate compliance with CCPA.,DATA MANAGEMENT AND PROTECTION
DM.MAFA.V1,Media accounted for and documented during transportation,DATA MANAGEMENT AND PROTECTION,"Establish a process to protect and control system media containing CUI during transport outside of controlled areas. Ensure accountability through documented activities and tracking of media to prevent loss, tampering, or destruction.",DATA MANAGEMENT AND PROTECTION
DM.MPS.V1,Media physically secured,DATA MANAGEMENT AND PROTECTION,"Implement physical security measures such as storing all media (like paper documents, laptops, USB drives) in locked cabinets and restricting access to only authorized personnel. Develop a system to classify all media based on the sensitivity of the data it contains. Maintain an inventory for all media, both electronic and physical, and conduct a full inventory check at least once every 12 months.Establish procedures for secure distribution (e.g., logging of all media sent outside the facility, using secure couriers). Obtain management approval before moving any media offsite.Create and log procedures for secure destruction (e.g., shredding paper, secure data wiping methods).Train employees at least yearly so that they can identify and manage this type of confidential data.",DATA MANAGEMENT AND PROTECTION
DM.NOPP.V1,Notice of privacy practices created and distributed,DATA MANAGEMENT AND PROTECTION,"Distribute a Notice of Privacy Practices (NPP) to patients, informing them of their rights under HIPAA and how their PHI will be used and disclosed.",DATA MANAGEMENT AND PROTECTION
DM.PHIA.V1,PHI access and amendment requests managed,DATA MANAGEMENT AND PROTECTION,Establish and maintain a documented process to manage individuals' requests for accessing and amending their protected health information (PHI).,DATA MANAGEMENT AND PROTECTION
DM.PHID.V1,PHI disclosure records maintained,DATA MANAGEMENT AND PROTECTION,"Establish a system to track disclosures of PHI, ensuring records of disclosures meet HIPAA requirements for accountability and transparency.",DATA MANAGEMENT AND PROTECTION
DM.PAFP.V1,Patient authorization for PHI use and disclosure obtained,DATA MANAGEMENT AND PROTECTION,"Require and maintain patient authorizations for the use or disclosure of PHI outside of permitted purposes (treatment, payment, and healthcare operations).",DATA MANAGEMENT AND PROTECTION
DM.PAPO.V1,Privacy and protection of PII,DATA MANAGEMENT AND PROTECTION,The organization shall identify and meet the requirements regarding the preservation of privacy and protection of PII according to applicable laws and regulations and contractual requirements.,DATA MANAGEMENT AND PROTECTION
DM.PDAN.V1,Privacy disclosure and notification mechanisms established,DATA MANAGEMENT AND PROTECTION,"Implement and maintain active communication channels for informing individuals about specific instances of personal data collection, use, and disclosure. The goal is to provide timely, context-specific privacy information beyond what's in the general privacy policy.Develop templates for data sharing, policy changes, and breach notifications so they can be sent to the relevant stakeholders when needed. This includes identifying relevant authorities, setting up systems to deliver these notices via appropriate channels (e.g., app, email), and establishing a process to handle responses to these notifications.Regularly review and update these mechanisms.",DATA MANAGEMENT AND PROTECTION
DM.PPCA.V1,Privacy policy created and maintained,DATA MANAGEMENT AND PROTECTION,"A privacy policy is developed, regularly updated, and made accessible to all relevant parties. The goal is to enable transparent communication of data handling practices and to protect individuals' privacy rights.",DATA MANAGEMENT AND PROTECTION
DM.PIPE.V1,Processing integrity policy established,DATA MANAGEMENT AND PROTECTION,"Establish systematic controls in your processing integrity policy that ensure the completeness, accuracy, validity, timeliness, and authorization of system processing while maintaining data quality throughout the entire processing lifecycle.",DATA MANAGEMENT AND PROTECTION
DM.RCGA.V1,Record copies generated and export enabled,DATA MANAGEMENT AND PROTECTION,Enable generating complete and precise copies of electronic records in both human‑readable and electronic formats for regulatory examination.,DATA MANAGEMENT AND PROTECTION
DM.RTDR.V1,Right to Delete Request Handling,DATA MANAGEMENT AND PROTECTION,"The organization must configure a system to handle Right-to-delete management. Under CCPA, the user has a right to have their data deleted upon request.",DATA MANAGEMENT AND PROTECTION
DM.RTLU.V1,Right to Limit Use of Sensitive PI,DATA MANAGEMENT AND PROTECTION,"The organization must configure a system to handle Right-to-limit use of SPI. Under CCPA, the user has a right to have their sensitive data not be shared upon request.",DATA MANAGEMENT AND PROTECTION
DM.IRTO.V1,Right to Opt out of Sale and Sharing,DATA MANAGEMENT AND PROTECTION,"The organization must configure a system to handle Right-to-Opt-out of sale. Under CCPA, the user has a right to have their data not be shared upon request.",DATA MANAGEMENT AND PROTECTION
DM.RTKR.V1,Right-to-Know Request Handling,DATA MANAGEMENT AND PROTECTION,"The organization must configure a system to handle Right-to-know management. Under CCPA, the user has a right to know what data of theirs has been collected.",DATA MANAGEMENT AND PROTECTION
DM.RSPT.V1,Role-Specific Privacy Training,DATA MANAGEMENT AND PROTECTION,"This control ensures that all employees receive role-specific privacy training to understand their responsibilities under the CCPA and related privacy laws. The training covers the handling of personal information, consumer rights, and organizational policies for protecting data. Completion is tracked, and refresher sessions are provided periodically to maintain awareness and compliance across the workforce.",DATA MANAGEMENT AND PROTECTION
DM.SDPE.V1,Secure disposal process established,DATA MANAGEMENT AND PROTECTION,"Establish and maintain a documented procedure for the secure disposal of electronic and physical media containing protected or classified data. This process renders the data unusable, unreadable, and indecipherable to prevent unauthorized access.",DATA MANAGEMENT AND PROTECTION
DM.SPIA.V1,Sensitive payment information automatically deleted,DATA MANAGEMENT AND PROTECTION,"Implement a system that automatically deletes sensitive payment information after it's no longer needed for business or legal purposes.For the purposes of this control sensitive data is any of the following:- Full track data (all the info from a card's magnetic stripe)- Card verification code (the 3 or 4 digit code on the card)- PIN (Personal Identification Number) or PIN blockConfigure your payment system to automatically delete this sensitive data right after approval. If you must keep it temporarily and have a solid business justification, make sure it's encrypted and deleted as soon as possible.Implement regular checks and reviews to make sure that no sensitive data is being stored. Train your team and instruct them to not write down or store this sensitive data",DATA MANAGEMENT AND PROTECTION
DM.SMOH.V1,Signature manifestation on human‑readable forms displayed,DATA MANAGEMENT AND PROTECTION,"Ensure that the printed name, date/time of signing, and meaning of the signature appear and are controlled like the record itself on any display or printout of a signed electronic record.",DATA MANAGEMENT AND PROTECTION
DM.SMP.V1,Signature manifestation provided,DATA MANAGEMENT AND PROTECTION,"Ensure electronic signatures clearly indicate signer identity, timestamp, and purpose on human‑readable outputs.",DATA MANAGEMENT AND PROTECTION
DM.SBTR.V1,Signatures bound to records,DATA MANAGEMENT AND PROTECTION,Permanently link each signature to its record to prevent dissociation or fraud.,DATA MANAGEMENT AND PROTECTION
DM.SUNM.V1,System use notification mechanisms established,DATA MANAGEMENT AND PROTECTION,Implement and maintain a system use notification message that includes privacy and security notices and must be displayed and acknowledged before granting access to any system accessing sensitive data.,DATA MANAGEMENT AND PROTECTION
DM.TI.V1,Test information,DATA MANAGEMENT AND PROTECTION,"Test information shall be appropriately selected, protected and managed.",DATA MANAGEMENT AND PROTECTION
DM.TGAR.V1,Track Gaps and Remediation,DATA MANAGEMENT AND PROTECTION,"This control ensures that any gaps identified in the privacy program—whether through audits, assessments, or regulatory reviews—are formally tracked and addressed. It requires the organization to document each gap, assign remediation actions, monitor progress, and verify completion to maintain compliance with CCPA and related privacy requirements. The control supports continuous improvement by ensuring that privacy risks are systematically mitigated and accountability is maintained.",DATA MANAGEMENT AND PROTECTION
DM.STTH.V1,Travel to high-risk locations secured,DATA MANAGEMENT AND PROTECTION,"Establish more stringent configurations for systems or components issued to employees traveling to high-risk areas. Upon return, conduct post-travel inspections of devices.",DATA MANAGEMENT AND PROTECTION
DM.UPHI.V1,Unintended PHI contained and deleted,DATA MANAGEMENT AND PROTECTION,Establish a process to contain and securely delete any Personal Health Information (PHI) added accidentally by your users.,DATA MANAGEMENT AND PROTECTION
DM.UPHI.V1,Unintended PHI detected,DATA MANAGEMENT AND PROTECTION,"Implement mechanisms to detect PHI in your systems in case it accidentally gets added by your users, with an escalation process when potential PHI is detected.",DATA MANAGEMENT AND PROTECTION
DM.UPHI.V1,Unintended PHI exposure reviewed,DATA MANAGEMENT AND PROTECTION,"Establish a regular process to review all instances of unintended Personal Health Information (PHI) exposure to understand the root cause, assess impact, and determine whether any changes are needed to prevent future exposures.",DATA MANAGEMENT AND PROTECTION
DM.UADO.V1,Use and disclosure of PHI managed,DATA MANAGEMENT AND PROTECTION,"Implement procedures to operationalize the policy defining the permissible uses and disclosures of protected health information (PHI), ensuring compliance with HIPAA requirements in day-to-day activities.",DATA MANAGEMENT AND PROTECTION
DM.VOCI.V1,Verification of Consumer Identity,DATA MANAGEMENT AND PROTECTION,"Verify the identity of consumers submitting privacy requests in accordance with CCPA requirements. Verification procedures ensure that access, deletion, or opt-out requests are processed only for legitimate requestors, protecting personal information from unauthorized disclosure. The process is documented, monitored, and updated as needed to maintain security and regulatory compliance.",DATA MANAGEMENT AND PROTECTION
DM.VPE.V1,Verification procedures established,DATA MANAGEMENT AND PROTECTION,Establish and maintain documented procedures for verifying the identity and authority of individuals or entities requesting access to protected information.,DATA MANAGEMENT AND PROTECTION
DM.WSAP.V1,Workflow sequencing and process controls enforced,DATA MANAGEMENT AND PROTECTION,Ensure processes enforce correct sequence of operations and detect invalid transitions.,DATA MANAGEMENT AND PROTECTION
DR.ABE.V1,Automated backups enabled,DISASTER RECOVERY,Automated backups are enabled for all high-risk data and critical systems.,DISASTER RECOVERY
DR.BCAD.V1,Business continuity and disaster recovery plan documented,DISASTER RECOVERY,Document clear and practical business continuity and disaster recovery plan that outline procedures for maintaining essential operations during disruptions.,DISASTER RECOVERY
DR.CADR.V1,Business continuity and disaster recovery policy established,DISASTER RECOVERY,"A comprehensive business continuity and disaster recovery policy is established, outlining the organization's strategies for responding to disruptive incidents and supporting business continuity.",DISASTER RECOVERY
DR.BCPD.V1,Business continuity plans documented,DISASTER RECOVERY,Document clear and practical business continuity plans that outline procedures for maintaining essential operations during disruptions.,DISASTER RECOVERY
DR.BCPT.V1,Business continuity plans tested,DISASTER RECOVERY,Regularly test your business continuity plans to confirm their effectiveness and readiness to maintain critical operations during disruptions.,DISASTER RECOVERY
DR.BIAP.V1,Business impact analysis performed,DISASTER RECOVERY,"To identify and prioritize critical business functions, assess potential impacts of disruptions, and determine recovery strategies through systematic business impact analysis (BIA).",DISASTER RECOVERY
DR.CPP.V1,Crisis plan prepared,DISASTER RECOVERY,Develop a crisis plan to facilitate a coordinated and effective response to security or operational incidents that may impact critical systems.,DISASTER RECOVERY
DR.CPT.V1,Crisis plan tested,DISASTER RECOVERY,"Regularly test your crisis plan to validate its effectiveness and ensure all team members are prepared to respond swiftly and efficiently to potential disruptions. Define a testing schedule based on your organization’s risk profile and regulatory requirements. Conduct tests at least annually, or more frequently for high-risk scenarios, to promote ongoing preparedness.You can use a variety of testing methods, such as tabletop exercises, live simulations, and role-playing scenarios. Include all necessary stakeholders in testing exercises.Record outcomes from each test, noting any gaps, response delays, or areas requiring improvement. Document lessons learned, recommended changes, and action items to refine the crisis plan based on test results.",DISASTER RECOVERY
DR.DBAR.V1,Data backup and recovery policy established,DISASTER RECOVERY,Develop and maintain a backup and recovery policy that defines the your approach to protecting and preserving critical data.,DISASTER RECOVERY
DR.DRPE.V1,Data recovery plan established,DISASTER RECOVERY,"Establish a data recovery plan that defines procedures for recovering data in case of data loss, corruption, or system failures. A robust data recovery plan helps minimize downtime and data loss in critical situations.",DISASTER RECOVERY
DR.DRPE.V1,Data recovery process established,DISASTER RECOVERY,"Establish a data recovery process that defines procedures for recovering data in case of data loss, corruption, or system failures. A robust data recovery process helps minimize downtime and data loss in critical situations.",DISASTER RECOVERY
DR.DRT.V1,Data recovery tested,DISASTER RECOVERY,Regularly test the data recovery process to validate its effectiveness and ensure that data can be successfully restored from backups. Testing helps identify any issues or gaps in the data recovery plan.,DISASTER RECOVERY
DR.DORS.V1,Digital operational resilience strategy created,DISASTER RECOVERY,"Establish and maintain a digital operational resilience strategy that outlines how your organization will ensure continuity, reliability, and security of critical ICT systems. This strategy should align with your business objectives and comply with regulatory standards focusing on preparedness, response, recovery, and adaptation to ICT-related disruptions.",DISASTER RECOVERY
DR.DRPD.V1,Disaster recovery plans documented,DISASTER RECOVERY,"Document disaster recovery (DR) plans to recover critical systems and maintain operational continuity following disruptive incidents. These plans should address potential risks, define recovery strategies, and integrate with broader business resilience efforts.",DISASTER RECOVERY
DR.DRPT.V1,Disaster recovery plans tested,DISASTER RECOVERY,Regularly test the organization's disaster recovery plans to ensure their effectiveness and identify areas for improvement. Testing helps validate the ability to recover critical systems and operations in the event of a disaster.,DISASTER RECOVERY
DR.RDI.V1,Recovery data isolated,DISASTER RECOVERY,Isolate the recovery data from the production environment to prevent accidental overwriting or corruption of backups. Keeping recovery data separate helps maintain the integrity and availability of backup copies.,DISASTER RECOVERY
ES.DPAV.V1,DMARC policy and verification used,EMAIL SECURITY,"DMARC (Domain-based Message Authentication, Reporting, and Conformance) policy and verification mechanisms are implemented to prevent email spoofing and phishing attacks.",EMAIL SECURITY
ES.EAAR.V1,Email account access restricted,EMAIL SECURITY,"Access to email accounts is restricted to administrators only, and isn't delegated to other non-admin users within the organization.",EMAIL SECURITY
ES.EBMC.V1,Email settings block malicious content,EMAIL SECURITY,"Email settings are configured to block malicious content, including malicious attachments, links, and scripts.",EMAIL SECURITY
EP.AMDO.V1,Anti-malware deployed on end-user devices,ENDPOINT SECURITY,"Anti-malware or antivirus solutions are deployed on end-user devices, such as laptops and workstations.",ENDPOINT SECURITY
EP.APAU.V1,Application packages automatically updated,ENDPOINT SECURITY,Utilize a library or package dependency management tool which automatically updates dependencies with known vulnerabilities.,ENDPOINT SECURITY
EP.ASLE.V1,Automatic session locking enforced,ENDPOINT SECURITY,Enforce automatic session locking to prevent unauthorized access to unattended devices. Automatic session locking helps protect sensitive data from unauthorized access and misuse.,ENDPOINT SECURITY
EP.CS.V1,Cabling security,ENDPOINT SECURITY,"Cables carrying power, data or supporting information services shall be protected from interception, interference or damage.",ENDPOINT SECURITY
EP.CDAC.V1,Clear desk and clear screen,ENDPOINT SECURITY,Clear desk rules for papers and removable storage media and clear screen rules for information processing facilities shall be defined and appropriately enforced.,ENDPOINT SECURITY
EP.CDE.V1,Configuration defaults established,ENDPOINT SECURITY,"Define, document, and enforce configuration defaults for systems that align with the most restrictive mode consistent with operational requirements. Identify, document, and approve deviations from these settings to maintain a secure and controlled system environment.",ENDPOINT SECURITY
EP.EDOE.V1,Data encrypted on end-user devices,ENDPOINT SECURITY,"Data stored on end-user devices (e.g., laptops, mobile devices) is encrypted to protect it in case of device loss or theft.",ENDPOINT SECURITY
EP.EUDM.V1,End user devices monitored for compliance,ENDPOINT SECURITY,Deploy a device compliance monitoring solution to track and verify the security status of end-user devices. This allows organizations to ensure devices meet security requirements without implementing full mobile device management.,ENDPOINT SECURITY
EP.EDAR.V1,Endpoint detection and response deployed,ENDPOINT SECURITY,"Implement Endpoint Detection and Response (EDR) tools to monitor endpoints for suspicious activity, unauthorized changes, and vulnerabilities. EDR solutions should be configured to provide real-time alerts for potential threats, enabling timely investigation and response.",ENDPOINT SECURITY
EP.EM.V1,Equipment maintenance,ENDPOINT SECURITY,"Equipment shall be maintained correctly to ensure availability, integrity and confidentiality of information.",ENDPOINT SECURITY
EP.ESAP.V1,Equipment siting and protection,ENDPOINT SECURITY,Equipment shall be sited securely and protected.,ENDPOINT SECURITY
EP.FMOE.V1,Firewall maintained on end-user devices,ENDPOINT SECURITY,"Firewalls are installed and properly maintained on end-user devices, such as laptops and workstations.",ENDPOINT SECURITY
EP.IOSO.V1,Installation of software on operational systems,ENDPOINT SECURITY,Procedures and measures shall be implemented to securely manage software installation on operational systems.,ENDPOINT SECURITY
EP.MU.V1,Mobile device management (MDM) used,ENDPOINT SECURITY,A mobile device management (MDM) solution is used to manage and secure end-user devices.,ENDPOINT SECURITY
