controlId,title,family,description,subFamily
OS.ES.V1,Employee screening,ORGANIZATIONAL SECURITY,"Background verification checks on all candidates to become personnel shall be carried out prior to joining the organization and on an ongoing basis taking into consideration applicable laws, regulations and ethics and be proportional to the business requirements, the classification of the information to be accessed and the perceived risks.",ORGANIZATIONAL SECURITY
OS.ETOC.V1,Employees trained on CUI handling,ORGANIZATIONAL SECURITY,"Establish a security training program to ensure all personnel are equipped to protect CUI, and appropriately manage public-facing content. The program must emphasize preventing unauthorized disclosure of CUI.",ORGANIZATIONAL SECURITY
OS.ECU.V1,Employment contracts used,ORGANIZATIONAL SECURITY,"Ensure that you are using employment contracts for all of your employees. These contracts should include confidentiality and non-disclosure agreements, legal responsibilities and rights, responsibilities for data handling, and actions to be taken if employees disregard the organization's security requirements.",ORGANIZATIONAL SECURITY
OS.ESRA.V1,"External support resources available (i.e., documentation)",ORGANIZATIONAL SECURITY,"Provide external support resources, such as documentation, user guides, and knowledge bases, to assist users in utilizing the organization's services effectively. Accessible support resources promote self-service and reduce support requests.",ORGANIZATIONAL SECURITY
OS.GHPM.V1,Group health plan managed,ORGANIZATIONAL SECURITY,Establish and maintain a process to manage group health plans in compliance with HIPAA.,ORGANIZATIONAL SECURITY
OS.HTC.V1,HIPAA training conducted,ORGANIZATIONAL SECURITY,Establish a process for providing HIPAA training to workforce members to build understanding of their responsibilities related to protecting protected health information (PHI) and complying with HIPAA regulations.,ORGANIZATIONAL SECURITY
OS.HCFI.V1,Healthcare clearinghouse functions isolated,ORGANIZATIONAL SECURITY,Establish a process to separate health care clearinghouse functions from other organizational operations to prevent unauthorized access or commingling of sensitive information.,ORGANIZATIONAL SECURITY
OS.HRSP.V1,Human resource security policy established,ORGANIZATIONAL SECURITY,"Develop and maintain a human resource policy that addresses information security responsibilities throughout the employment lifecycle, from recruitment to termination.",ORGANIZATIONAL SECURITY
OS.IBP.V1,ISMS budget provided,ORGANIZATIONAL SECURITY,"Allocate a dedicated budget for the Information Security Management System (ISMS) to support the resources, tools, and personnel required to implement, maintain, and improve the organization’s security posture.",ORGANIZATIONAL SECURITY
OS.IVBS.V1,Identity verified before signature assignment,ORGANIZATIONAL SECURITY,Verify a person's identity before establishing or sanctioning any element of their electronic signature.,ORGANIZATIONAL SECURITY
OS.IROI.V1,Independent review of information security,ORGANIZATIONAL SECURITY,"The organization's approach to managing information security and its implementation including people, processes and technologies shall be reviewed independently at planned intervals, or when significant changes occur.",ORGANIZATIONAL SECURITY
OS.ISA.V1,Information security awareness,ORGANIZATIONAL SECURITY,"Personnel of the organization and relevant interested parties shall receive appropriate information security awareness, education and training and regular updates of the organization's information security policy, topic-specific policies and procedures, as relevant for their job function.",ORGANIZATIONAL SECURITY
OS.ISCI.V1,Information security communities identified,ORGANIZATIONAL SECURITY,"Stay connected with the broader security community by engaging with professional groups, industry forums, and security events to keep current with evolving threats and best practices.",ORGANIZATIONAL SECURITY
OS.ISER.V1,Information security event reporting,ORGANIZATIONAL SECURITY,The organization shall provide a mechanism for personnel to report observed or suspected information security events through appropriate channels in a timely manner.,ORGANIZATIONAL SECURITY
OS.ISIP.V1,Information security in project management,ORGANIZATIONAL SECURITY,Information security shall be integrated into project management.,ORGANIZATIONAL SECURITY
OS.ISIP.V1,Information security in project management integrated,ORGANIZATIONAL SECURITY,Incorporate information security considerations into all stages of project management.,ORGANIZATIONAL SECURITY
OS.ISIS.V1,Information security in supplier relationships,ORGANIZATIONAL SECURITY,Processes and procedures shall be defined and implemented to manage the information security risks associated with the use of supplier's products or services.,ORGANIZATIONAL SECURITY
OS.ISMS.V1,Information security management system,ORGANIZATIONAL SECURITY,"The organization shall establish, implement, maintain and continually improve an information security management system, including the processes needed and their interactions, in accordance with the requirements of ISO 27001.",ORGANIZATIONAL SECURITY
OS.ISOA.V1,Information security objective and planning to achieve them,ORGANIZATIONAL SECURITY,"The organization shall establish information security objectives at relevant functions and levels. The information security objectives shall: a) be consistent with the information security policy; b) be measurable (if practicable); c) take into account applicable information security requirements, and results from risk assessment and risk treatment; d) be monitored; e) be communicated; f) be updated as appropriate; g) be available as documented information. The organization shall retain documented information on the information security objectives. When planning how to achieve its information security objectives, the organization shall determine: h) what will be done; i) what resources will be required; j) who will be responsible; k) when it will be completed; and l) how the results will be evaluated.",ORGANIZATIONAL SECURITY
OS.ISPE.V1,Information security policy established,ORGANIZATIONAL SECURITY,Develop and maintain an information security policy that outlines your approach to protecting information assets and systems.,ORGANIZATIONAL SECURITY
OS.ISPR.V1,Information security program established,ORGANIZATIONAL SECURITY,"Establish an information security program for your organization - this security program should include details such as who holds what security positions in the company, what the objectives of the program are, what the SLAs are for your applications, as well as including information about what policies you have in place and how often they are reviewed.",ORGANIZATIONAL SECURITY
OS.ISRA.V1,Information security risk assessment,ORGANIZATIONAL SECURITY,"The organization shall perform information security risk assessments at planned intervals or when significant changes are proposed or occur, taking account of the criteria established in 6.1.2 a). The organization shall retain documented information of the results of the information security risk assessments.",ORGANIZATIONAL SECURITY
OS.ISRT.V1,Information security risk treatment,ORGANIZATIONAL SECURITY,The organization shall retain documented information of the results of the information security risk treatment.,ORGANIZATIONAL SECURITY
OS.ISRA.V1,Information security roles and responsibilities,ORGANIZATIONAL SECURITY,Information security roles and responsibilities shall be defined and allocated according to the organization needs.,ORGANIZATIONAL SECURITY
OS.ISAI.V1,Information sharing arrangements implemented,ORGANIZATIONAL SECURITY,"Determine the purpose and scope of information sharing, such as exchanging threat intelligence, indicators of compromise, or emerging threat trends. Identify trusted partners, industry groups, or public authorities with whom information can be shared securely.Create formal agreements (e.g., Memorandums of Understanding or Non-Disclosure Agreements) that outline the terms of information sharing, including responsibilities, confidentiality obligations, and usage limitation",ORGANIZATIONAL SECURITY
OS.ICCI.V1,Infrastructure changes are communicated internally,ORGANIZATIONAL SECURITY,Establish effective communication channels to inform relevant teams and stakeholders about planned infrastructure changes. Internal communication ensures awareness and coordination during change implementation.,ORGANIZATIONAL SECURITY
OS.IPR.V1,Intellectual property rights,ORGANIZATIONAL SECURITY,The organization shall implement appropriate procedures to protect intellectual property rights.,ORGANIZATIONAL SECURITY
OS.IAP.V1,Internal Audit Performed,ORGANIZATIONAL SECURITY,The organization shall conduct internal audits at planned intervals to provide information on whether the information security management system: a) conforms to 1) the organization’s own requirements for its information security management system; 2) the requirements of this document; b) is effectively implemented and maintained.,ORGANIZATIONAL SECURITY
OS.IAP.V1,Internal Audit Program,ORGANIZATIONAL SECURITY,"The organization shall plan, establish, implement and maintain an audit programme(s), including the frequency, methods, responsibilities, planning requirements and reporting. When establishing the internal audit programme(s), the organization shall consider the importance of the processes concerned and the results of previous audits. The organization shall: a) define the audit criteria and scope for each audit; b) select auditors and conduct audits that ensure objectivity and the impartiality of the audit process; c) ensure that the results of the audits are reported to relevant management; Documented information shall be available as evidence of the implementation of the audit programme(s) and the audit results.",ORGANIZATIONAL SECURITY
OS.IPPE.V1,Internal privacy policies established,ORGANIZATIONAL SECURITY,"Develop an employee privacy policy governing the collection and use of employee data. Update internal privacy notices for employees. Clearly communicate what data is collected, how it's used, and employee rights.Establish a process for regular review and update of these policies.",ORGANIZATIONAL SECURITY
OS.ISAP.V1,Internal security audit performed,ORGANIZATIONAL SECURITY,"An internal security audit is performed annually to evaluate the effectiveness of information security controls, verify compliance with security requirements, and identify areas for improvement.",ORGANIZATIONAL SECURITY
OS.ISCM.V1,Internal security communication maintained,ORGANIZATIONAL SECURITY,"Establish regular communication channels for internal security updates, alerts, and policies to keep employees informed about relevant security practices, potential threats, and compliance requirements.",ORGANIZATIONAL SECURITY
OS.IOIA.V1,Inventory of information and other associated assets,ORGANIZATIONAL SECURITY,"An inventory of information and other associated assets, including owners, shall be developed and maintained.",ORGANIZATIONAL SECURITY
OS.LAC.V1,Leadership and commitment,ORGANIZATIONAL SECURITY,Top management shall demonstrate leadership and commitment with respect to the information security management system by: a) ensuring the information security policy and the information security objectives are established and are compatible with the strategic direction of the organization; b) ensuring the integration of the information security management system requirements into the organization’s processes; c) ensuring that the resources needed for the information security management system are available; d) communicating the importance of effective information security management and of conforming to the information security management system requirements; e) ensuring that the information security management system achieves its intended outcome(s); f) directing and supporting persons to contribute to the effectiveness of the information security management system; g) promoting continual improvement; and h) supporting other relevant management roles to demonstrate their leadership as it applies to their areas of responsibility.,ORGANIZATIONAL SECURITY
OS.LSCE.V1,Leadership security commitment established,ORGANIZATIONAL SECURITY,"Your leadership team, including founders and board members, needs to demonstrate they're serious about security. This means actively overseeing and supporting your company's security efforts, not just delegating it to the tech team.",ORGANIZATIONAL SECURITY
OS.LRTA.V1,Legal requirements tracked and met,ORGANIZATIONAL SECURITY,"Legal, statutory, regulatory and contractual requirements relevant to information security and the organization's approach to meet these requirements shall be identified, documented and kept up to date.",ORGANIZATIONAL SECURITY
OS.MR.V1,Management responsibilities,ORGANIZATIONAL SECURITY,"Management shall require all personnel to apply information security in accordance with the established information security policy, topic-specific policies and procedures of the organization.",ORGANIZATIONAL SECURITY
OS.MRG.V1,Management review - General,ORGANIZATIONAL SECURITY,"Top management shall review the organization's information security management system at planned intervals to ensure its continuing suitability, adequacy and effectiveness.",ORGANIZATIONAL SECURITY
OS.MRI.V1,Management review implemented,ORGANIZATIONAL SECURITY,"Conduct regular management reviews to assess the effectiveness, adequacy, and alignment of the compliance framework with organizational objectives, risks, and regulatory requirements.",ORGANIZATIONAL SECURITY
OS.MRI.V1,Management review inputs,ORGANIZATIONAL SECURITY,"The management review shall include consideration of: a) the status of actions from previous management reviews; b) changes in external and internal issues that are relevant to the information security management system; c) changes in needs and expectations of interested parties that are relevant to the information security management system; d) feedback on the information security performance, including trends in: 1) nonconformities and corrective actions; 2) monitoring and measurement results; 3) audit results; 4) fulfilment of information security objectives; e) feedback from interested parties; f) results of risk assessment and status of risk treatment plan; g) opportunities for continual improvement.",ORGANIZATIONAL SECURITY
OS.MRR.V1,Management review results,ORGANIZATIONAL SECURITY,The results of the management review shall include decisions related to continual improvement opportunities and any needs for changes to the information security management system. Documented information shall be available as evidence of the results of management reviews.,ORGANIZATIONAL SECURITY
OS.MTDR.V1,Model training data restrictions enforced,ORGANIZATIONAL SECURITY,Implement and maintain technical and procedural controls that prevent customer data from being used in model training without explicit authorization.,ORGANIZATIONAL SECURITY
OS.NDM.V1,Network diagrams maintained,ORGANIZATIONAL SECURITY,Maintain an accurate and current visual representation of your organization's network architecture.,ORGANIZATIONAL SECURITY
OS.NAC.V1,Non-conformance and corrective action procedures established,ORGANIZATIONAL SECURITY,"Systematically identify, document, investigate, and address information security non-conformities through structured corrective actions that prevent recurrence and drive continuous improvement.",ORGANIZATIONAL SECURITY
OS.NAC.V1,Nonconformity and corrective action,ORGANIZATIONAL SECURITY,"When a Nonconformity occurs, the organization shall: a) React to the nonconformity, and as applicable: 1) take action to control and correct it; 2) deal with the consequences b) evaluate the need for action to eliminate the causes of nonconformity, in order that it does not recur or occur elsewhere, by; 1) reviewing the nonconformity; 2) determining the causes of the nonconformity; and 3) determining if similar nonconformities exist, or could potentially occur c) implement any action needed; d) review the effectiveness of any corrective action taken; and e) make changes to the information security management system, if necessary. Corrective actions shall be appropriate to the effects of the nonconformities encountered. Documented information shall be available as evidence of: f) The nature of the nonconformities and any subsequent actions taken, g) the results of any corrective action.",ORGANIZATIONAL SECURITY
OS.OPE.V1,Offboarding process established,ORGANIZATIONAL SECURITY,An offboarding process is established for departing employees to ensure that they are removed from relevant systems and accounts.,ORGANIZATIONAL SECURITY
OS.OPE.V1,Onboarding process established,ORGANIZATIONAL SECURITY,An onboarding process is established for new employees to ensure that they are properly trained and equipped to perform their job responsibilities.,ORGANIZATIONAL SECURITY
OS.OPAC.V1,Operation planning and control,ORGANIZATIONAL SECURITY,"The organization shall plan, implement and control the processes needed to meet requirements, and to implement the actions determined in Clause 6, by: — establishing criteria for the processes; — implementing control of the processes in accordance with the criteria. Documented information shall be available to the extent necessary to have confidence that the processes have been carried out as planned. The organization shall control planned changes and review the consequences of unintended changes, taking action to mitigate any adverse effects, as necessary. The organization shall ensure that externally provided processes, products or services that are relevant to the information security management system are controlled.",ORGANIZATIONAL SECURITY
OS.OPM.V1,Operational procedures maintained,ORGANIZATIONAL SECURITY,"Establish and maintain standardized operating procedures that ensure consistent, secure, and reliable operation of information systems and supporting infrastructure.",ORGANIZATIONAL SECURITY
OS.ORRA.V1,"Organizational roles, responsibilities and authorities",ORGANIZATIONAL SECURITY,Top management shall ensure that the responsibilities and authorities for roles relevant to information security are assigned and communicated within the organization. Top management shall assign the responsibility and authority for: a) ensuring that the information security management system conforms to the requirements of this document; b) reporting on the performance of the information security management system to top management.,ORGANIZATIONAL SECURITY
OS.ODC.V1,Outsourced development controls,ORGANIZATIONAL SECURITY,"The organization shall direct, monitor and review the activities related to outsourced system development.",ORGANIZATIONAL SECURITY
OS.PMU.V1,Password manager used,ORGANIZATIONAL SECURITY,A company-wide password manager is deployed to securely store and share credentials across the organization. All shared accounts and secrets are shared through the password manager using a principle of least privilege.,ORGANIZATIONAL SECURITY
OS.PEC.V1,Performance evaluations conducted,ORGANIZATIONAL SECURITY,"Conduct regular performance evaluations for employees to assess their job performance, identify areas for improvement, and recognize exceptional contributions. Performance evaluations support talent development and performance management.",ORGANIZATIONAL SECURITY
OS.PAR.V1,Physical access restricted,ORGANIZATIONAL SECURITY,"Physical access to the organization's facilities, equipment, and systems is restricted to authorized personnel only.",ORGANIZATIONAL SECURITY
OS.PE.V1,Physical entry,ORGANIZATIONAL SECURITY,Secure areas shall be protected by appropriate entry controls and access points.,ORGANIZATIONAL SECURITY
OS.PSM.V1,Physical security monitoring,ORGANIZATIONAL SECURITY,Premises shall be continuously monitored for unauthorized physical access.,ORGANIZATIONAL SECURITY
OS.PSP.V1,Physical security perimeters,ORGANIZATIONAL SECURITY,Security perimeters shall be defined and used to protect areas that contain information and other associated assets.,ORGANIZATIONAL SECURITY
OS.PSPE.V1,Physical security policy established,ORGANIZATIONAL SECURITY,Establish a physical security policy that outlines the organization's processes for protecting physical assets and resources.,ORGANIZATIONAL SECURITY
OS.POC.V1,Planning of Changes,ORGANIZATIONAL SECURITY,"When the organization determines the need for changes to the information security management system, the changes shall be carried out in a planned manner.",ORGANIZATIONAL SECURITY
OS.PE.V1,Policies Established,ORGANIZATIONAL SECURITY,"Top management shall establish an information security policy that: a) is appropriate to the purpose of the organization; b) includes information security objectives (see 6.2) or provides the framework for setting information security objectives; c) includes a commitment to satisfy applicable requirements related to information security; d) includes a commitment to continual improvement of the information security management system. The information security policy shall: e) be available as documented information; f) be communicated within the organization; g) be available to interested parties, as appropriate.",ORGANIZATIONAL SECURITY
OS.PFIS.V1,Policies for information security,ORGANIZATIONAL SECURITY,"Information security policy and topic-specific policies shall be defined, approved by management, published, communicated to and acknowledged by relevant personnel and relevant interested parties, and reviewed at planned intervals and if significant changes occur.",ORGANIZATIONAL SECURITY
OS.PSBR.V1,Policies signed by relevant personnel,ORGANIZATIONAL SECURITY,"Security policies are formally acknowledged and signed by all relevant personnel, establishing accountability for security responsibilities.",ORGANIZATIONAL SECURITY
OS.PFCD.V1,Policy for compelled disclosure from law enforcement established,ORGANIZATIONAL SECURITY,Develop a formal policy outlining procedures for responding to law enforcement requests for data. Establish a process for verifying the authenticity and legality of disclosure requests.,ORGANIZATIONAL SECURITY
OS.POA.V1,Privacy official assigned,ORGANIZATIONAL SECURITY,Designate a privacy official responsible for overseeing the organization's compliance with privacy requirements and managing privacy-related initiatives.,ORGANIZATIONAL SECURITY
OS.PAPA.V1,Protecting against physical and environmental threats,ORGANIZATIONAL SECURITY,"Protection against physical and environmental threats, such as natural disasters and other intentional or unintentional physical threats to infrastructure shall be designed and implemented.",ORGANIZATIONAL SECURITY
OS.POR.V1,Protection of records,ORGANIZATIONAL SECURITY,"Records shall be protected from loss, destruction, falsification, unauthorized access and unauthorized release.",ORGANIZATIONAL SECURITY
OS.PFCR.V1,Public facing content review process established,ORGANIZATIONAL SECURITY,Establish a formal process to review publicly accessible systems for Controlled Unclassified Information (CUI) and ensure its immediate removal if discovered. This process protects sensitive information from unauthorized disclosure.,ORGANIZATIONAL SECURITY
OS.PSPA.V1,Public security page available,ORGANIZATIONAL SECURITY,"Maintain a public-facing security page that clearly communicates the organization's security posture, practices, and commitments.",ORGANIZATIONAL SECURITY
OS.RPE.V1,Recruitment program established,ORGANIZATIONAL SECURITY,"Establish a recruitment program designed to attract, develop, and retain competent individuals whose skills and qualifications align with the entity's strategic objectives and operational needs",ORGANIZATIONAL SECURITY
OS.RCPF.V1,Reference checks performed for employees,ORGANIZATIONAL SECURITY,"Reference checks are conducted when hiring new employees to verify their qualifications, experience, and suitability for the role.",ORGANIZATIONAL SECURITY
OS.CRPS.V1,Regular phishing simulations conducted,ORGANIZATIONAL SECURITY,"Conduct regular phishing simulations to assess the effectiveness of your organization in detecting and preventing social engineering attacks. These simulations help evaluate whether existing training and response procedures are functioning as intended, ensuring that employees are prepared to recognize and respond to phishing attempts.",ORGANIZATIONAL SECURITY
OS.RSA.V1,Regular self assessments performed,ORGANIZATIONAL SECURITY,"Ensure all employees conduct regular self-assessments to review their performance, responsibilities, and effectiveness in achieving organizational objectives.",ORGANIZATIONAL SECURITY
OS.RAI.V1,Relevant authorities identified,ORGANIZATIONAL SECURITY,"Maintain a clear record of which data protection authorities have jurisdiction over your operations, and establish reliable communication channels with them for compliance reporting and incident response.",ORGANIZATIONAL SECURITY
OS.RWPE.V1,Remote work policy established,ORGANIZATIONAL SECURITY,"Establish a remote work policy that outlines the requirements, guidelines, and best practices for securely working from outside the office. Ensure the policy covers topics such as approved devices, secure network connections, data protection measures, and communication protocols.",ORGANIZATIONAL SECURITY
OS.RWC.V1,Remote working controls,ORGANIZATIONAL SECURITY,"Security measures shall be implemented when personnel are working remotely to protect information accessed, processed or stored outside the organization's premises.",ORGANIZATIONAL SECURITY
